,Arabic,English
784,{وَعَدَ اللَّهُ الَّذِينَ آمَنُوا مِنْكُمْ وَعَمِلُوا الصَّالِحَاتِ لَيَسْتَخْلِفَنَّهُمْ فِي الْأَرْضِ كَمَا اسْتَخْلَفَ الَّذِينَ مِنْ قَبْلِهِمْ} [النور: 55],Allah has promised those of you who believe and practice pious acts that He will grant them sovereignty over the Earth
785,قال سمرة ابن غانم والله لقد دهشت أنفسنا بقوله وحملنا على المتنصرة وضرار ينشد:,Samurah bin Ghanim narrates:
786,إلا فاحملوا نحو اللئام الكواذب… لترووا سيوفا من دماء الكتائب,"Attack the liars who are low,"
787,قال الواقدي: ثم حمل ضرار ونحن من ورائه وبذلنا نفوسنا وروينا سيوفنا ورماحنا من المتنصرة وجرى الحرب بما لا يوصف وضرار فيهم كانه النار في الحطب اليابس وجبلة بن الأيهم يتعجب من حملاته وضرباته فأمر قومه أن يقصدوا جواده بسهامهم ففعلوا ذلك فانصرع الجواد ووقع ضرار,Dirar attacked with us in the rear offering our lives and landing our swords and spears at the Christians. Dirar was like a blazing fire burning dry firewood. Jabalah was amazed at his fighting and ordered his men to shoot his horse with arrows. They fired and the horse came tumbling down with Dirar.
788,فتكاثروا عليه وأخذوه أسيرا وأخذوا بقية أصحابه وساروا يريدون أنطاكية فالتقوا بيوقنا وأبنة الملك كما ذكرنا.,They pounced on him and captured him. The Christians captured the rest of the Muslims and went to Antioch. On the way they met Yuqanna and Caesar’s daughter as has been previously mentioned.
789,قال الواقدي: ولقد حدثني معمر بن رواحة عن القاسم عن خزامة بن عمرو وعن أبي المنذر أن سفينة مولى رسول الله صلى الله عليه وسلم كان في حرب ضرار بن الأزور اسيرا فلما كان الليل انطلق هاربا يلتمس الوصول إلى ابي عبيدة فإذا هو بأسد عارضه فقال سفينة يا أبا الحرث أنا مولى رسول الله صلى الله عليه وسلم وكان من أمري كيت وكيت,"Ma’mar bin Rawahah narrates from al-Qasim who narrates from Khuzamah bin ‘Amr and Abu al-Munthr: Safinah, the freed slave of Rasulullah, was amongst those captured in Dirar’s expedition. At night he managed to escape and started to make his way to Abu ‘Ubaydah. Suddenly a lion confronted him. He called out, “O lion, I am the freed slave of Rasulullah S.” and proceeded to describe his relationship with Rasulullah."
790,فقرب منه وهو يبصبص بذنبه حتى وقف إلى جانبه واشار إليه برأسه أن سر,"The lion came to him, wagging his tail and stood at his side. It indicated with its head that he should follow him."
791,فسرت وهو إلى جانبي حتى أتى بي إلى بلد من صلحنا فتركني ومضى.,Safinah narrates:
792,قال الواقدي: فلما وصل سفينة الجيش حدث الناس باسر ضرار ومن معه فصعب ذلك على المسلمين وبكى أبو عبيدة وخالد بن الوليد على أسرهم وقالا لا حول ولا قوة إلا بالله العلي العظيم,"When Safinah reached the Muslim camp he told them about Dirar’s capture. The Muslims were upset and Khalid and Abu ‘Ubaydah wept and said, “There is no ability to avoid evil and no power to do good except through Allah, the Most High, the Most Mighty.”"
793,وبلغ ذلك أخته خولة فقالت: أنا لله وأنا إليه راجعون يا بن أمي ليت شعري في السلاسل أوثقوك أم بالحديد قيدوك أم في البيداء طرحوك أم بدمائك خضبوك وأنشدت تقول:,"When Dirar’s sister, Khawlah, heard she said, “Verily we belong to Allah and to Him do we return. O son of my mother, if only I knew whether you were tied up in chains or iron or flung in the wilderness or stained with your own blood.”"
794,إلا مخبر بعد الفراق يخبرنا,"Is there no informer to inform us after separation,"
795,قال الواقدي: ولقد بلغني عن وأصل بن عوف إنه قال اجتمعت النساء من العربيات ممن كان لهم أسير مع ضرار عند خولة ومن جملتهم مزروعة بنت عملوق الحيرية وكانت من فصحاء زمانها وكان ولدها صابر بن أوس فيمن أسر مع ضرار فجعلت تندب ولدها وتقول:,I (al-Waqidi) have been informed by Wail bin ‘Awf:
796,أيا ولدي قد زاد قلبي تلهبا… وقد أحرقت مني الخدود المدامع,"O my son, my heart is ablaze And tears bum my cheeks."
797,فقالت لهم سليمى بنت سعيد بن زيد بن عمرو بن نفيل وكانت من الزاهدات العابدات أبهذا أمركن الله انما امركن بالصبر ووعدكن على ذلك الأجر أما سمعتن ما قال الله سبحانه وتعالى: {الَّذِينَ إِذَا أَصَابَتْهُمْ مُصِيبَةٌ قَالُوا إِنَّا لِلَّهِ وَإِنَّا إِلَيْهِ رَاجِعُونَ*أُولَئِكَ عَلَيْهِمْ صَلَوَاتٌ مِنْ رَبِّهِمْ وَرَحْمَةٌ وَأُولَئِكَ هُمُ الْمُهْتَدُونَ} [البقرة:157],"Salama bint Sa’id bin Zayd bin ‘Amr bin Nufayl who was a great ascetic and worshipper then said to her, “Is this what Allah has ordered you with? He has ordered you with patience and promised you reward for that. Have you not heard Allah’s saying:"
798,فاصبرن تؤجرن فسكتن عن البكاء,So you women should be patient in earning your reward and stop your sobbing.”
799,قال الواقدي: ولما ورد الخمس على أمير المؤمنين عمر بن الخطاب رضي الله عنه وكتاب أبي عبيدة مع رباح بن غانم اليشكري وقع الصائح في المدينة بقدومه,When Ribah bin Ghanim al-Yashkuri brought the one-fifth share of the booty and Abu ‘Ubaydah’s letter to ‘Umar his arrival was announced in al-Madinah.
800,فاجتمع الناس إلى المسجد ليسمعوا ما تجدد من أمر المسلمين فلما دخل رباح المسجد بدأ بالسلام على قبر رسول الله صلى الله عليه وسلم وعلى قبر أبي بكر وصلى ركعتين وأتى عمر وقبل يده وعرض عليه الكتاب,"The people therefore gathered in the Masjid to hear the news about the Muslims. Ribah entered the Masjid, made salam at the graves of Rasulullah and Abu Bakr and prayed two rak’at. He then went to ‘Umar, kissed his hand and gave him the letter."
801,فقرأه على المسلمين فضجوا بالتهليل والتكبير وصلوا على البشير النذير واخذ الخمس وكتب إلى ابي عبيدة يأمره بالمسير إلى انطاكية ولا يصده عن ذلك شيء ورد الجواب مع رباح اليشكري.,"‘Umar read it out to the Muslims who raised cries of “La ilaha illallah! Allahu Akbar!” and recited salutations upon Rasulullah. He then took the booty and wrote to Abu ‘Ubaydah, ordering him to invade Antioch and not to be deterred by anything. He gave the letter to Ribah for delivery."
802,قال الواقدي: اخبرني مازن بن عبد ربه عن مالك بن أسيد عن جده مروان بن الجرير,"Mzin bin ‘Abdi Rabbihi narrates from Malik bin Usayd who narrates from his grandfather, Marwan bin al-Jarir:"
803,أن الجواب لما ورد على أبي عبيدة سار من يومه يطلب انطاكية قال: وأما ما كان من أمر يوقنا رحمه الله تعالى وجبلة بن الأيهم لعنه الله فانهم ساروا إلى انطاكية وسبق البشير إلى الملك هرقل بقدوم ابنته مع يوقنا وقدوم يوقنا ومعه المائتا أسير من المسلمين فأمر بتزيين البلد والبيع فاظهرت الروم زينتها ودفعت الصدقات إلى الفقراء وأخرج موكب الروم إلى لقائهم مع ابن اخيه في زينة عظيمة ودخل القوم وهم في زيهم وحشمهم وكان يوما مشهودا,"When Abu ‘Ubaydah received the reply he left on the same day for Antioch. As for Yuqanna (upon whom be Allah’s mercy) and Jabalah (upon whom be Allah’s curse), they continued towards Antioch. A messenger went ahead to tell Caesar about the arrival of Olivia, Yuqanna and the 200 Muslim prisoners. Caesar was delighted and ordered the entire city and all the churches to be decorated. The Romans obeyed and also gave charity to the poor. Caesar’s nephew came out in a great glamorous parade. It was a memorable day."
804,وقد ترجلت الملكية والسريرية بين يدي ابنة الملك وخرج كل من بانطاكية وقدموا أصحاب رسول الله صلى الله عليه وسلم أمامها وهم مشدودون والروم تشتمهم وتبصق عليهم وقد دارت بهم الرجال والبطارقة ودخلت ابنة الملك إلى قصر أبيها.,"The courtiers and aristocrats walked ahead of Olivia and every single inhabitant of Antioch came out to witness the spectacle. They pushed the SaMbah (who were all tied up) ahead of her. The Romans swore and spat at them. Both patricians and commoners went around them, swearing and spitting until Olivia entered the palace."
805,قال الواقدي: ودخل جبلة بن الأيهم يوقنا على الملك فخلع عليهما وعلى كبار أصحابهما ثم إنهم احضروا الصحابة وأوقفوهم بين يديه وهم في الحبال فلما وقفوا صاحت بهم الحجاب اسجدوا إلى الأرض تعظيما للملك فلم يلتفتوا إلى قولهم ولا اعتنوا به,"Jabalah and Yuqanna came in front of Heraclius who gave them and their senior officers robes of honour. The Muslims were brought and made to stand in front of him. The chamberlain shouted, “Have respect! Prostrate!” but they ignored him."
806,فقال لهم الحاجب الكبير: ما منعكم أن تعظموا الملك بالسجود بين يديه فقال لهم ضرار: لا يحل لنا أن نسجد لمخلوق وقد نهانا نبينا صلى الله عليه وسلم عن ذلك.,Chamberlain: Why do you not respect Caesar and bow to him?
807,قال الواقدي: حدثني سهل بن برقان رضي الله عنه عن السائب بن جازم عن الحكم بن مازن قال لما وقف ضرار والصحابة بين يدي هرقل خاطبهم من غير ترجمان وأراد الملك أن يسمع بطارقته وحجابه بما كان يحدثهم به حين بعث النبي صلى الله عليه وسلم,Sahl bin Barqan narrates from as-Saib bin Hazm who narrates from al-Hakam bin Mazin:
808,وذلك إنه جمعهم إليه لما بلغه أن النبي صلى الله عليه وسلم قد ظهر وقال هذا هو النبي المبعوث الذي بشر به عيسى بن مريم وهو صاحب الوقت ولا بد لدينه أن يظهر حتى يملأ المشرق والمغرب,"When he had first heard from Rasulullah he gathered them and said, “This is the Prophet about whom Jesus son of Mary had prophesied. He will be the master of this era. His religion will triumph over east and west.”"
809,ثم أن هرقل دعاهم لأداء الجزية فأرادوا قتله فأراد ذلك اليوم أن يبين لهم حقيقة قوله وانه أراد بذلك الإصلاح لهم ولجالهم,"When he then proposed to pay Jizyah they wanted to kill him. He then wanted to explain to them what he had said, intending this for their benefit."
810,فقال لضرار ومن معه من يخاطبني منكم عما أسأله من العلم,Heraclius: Who amongst you will answer my questions?
811,فأشاروا إلى قيس بن عاصم الأنصاري رضي الله عنه وكان شيخا معمرا وكان شاهد جميع أحوال رسول الله صلى الله عليه وسلم ومعجزاته وغزواته فلما أشاروا إليه قال للملك قل: ما أنت قائل أيها الملك,"The Sahabah pointed at Qays bin ‘Asim al-Ansari, who was elderly and had witnessed all the conditions, miracles and expeditions of Rasulullah S."
812,قال هرقل: كيف نزل علي نبيكم الوحي أول مبتدأ أمره فقال قيس ابن عاصم سأل هذا السؤال لنبينا صلى الله عليه وسلم رجل من مكة يقال له الحرث بن هشام: فقال لرسول الله صلى الله عليه وسلم كيف يأتيك الوحي,Heraclius: How did revelation first come to your Prophet?
813,فقال رسول الله صلى الله عليه وسلم: “يأتيني أحيانا مثل صلصلة الجرس وهو أشده علي فينفصم عني وقد وعيت عنه وأحيانا يتمثل لي الملك رجلا فيكلمني فأعي ما يقول”,"He replied, “Sometimes it comes like the ringing of a bell which is severest upon me and I hear revelation from it. Sometimes the angel comes in human form and I hear him.”"
814,قال قيس: ولقد كان ينزل عليه في اليوم الشديد البرد فينفصم عنه وأن جبينه ليرفض عرقا فأول ما بدىء به رسول الله صلى الله عليه وسلم من الوحي الرؤيا الصادقة في النوم فكان لا يرى رؤيا إلا جاءت مثل فلق الصبح,Revelation would come down upon him in intense cold yet it was so severe upon him that his forehead dripped with perspiration. The revelation first came to him through true dreams. He would not dream anything except that it would transpire in exactly the same way the following morning.
815,ثم حبب إليه الخلاء فكان يخلو بغار حراء فيتحنث فيه أي يتعبد الليالي ذوات العدد,He began to love solitude and isolated himself in the cave of Hira and resolved to spend several nights there in worship.
816,فلم يزل كذلك حتى جاءه الملك وقال له: اقرأ فقال لست بقارىء قال فأخذني فغطني حتى بلغ مني الجهد ثم ارسلني وقال لي أرسلي اقرأ فقلت: ما أنا بقاريء فأخذني فغطني حتى بلغ مني الجهد ثم أرسلني فقال:,"He remained like this until an angel came to him and said, “Read!” He replied, “I cannot read!”"
817,"{اقْرَأْ بِاسْمِ رَبِّكَ الَّذِي خَلَقَ, خَلَقَ الْأِنْسَانَ مِنْ عَلَقٍ, اقْرَأْ وَرَبُّكَ الْأَكْرَمُ, الَّذِي عَلَّمَ بِالْقَلَمِ, عَلَّمَ الْأِنْسَانَ مَا لَمْ يَعْلَمْ}","Read in the name of your Rabb Who created. Who created manfrom a clot of blood. Read! And your Rabb is Most Noble, He Who taught by means of the pen. He taught man that which he knew not. [96:1-5]"
818,فرجّع بها رسول الله صلى الله عليه وسلم يرجف بهافؤاده فدخل على خديجة بنت خويلد رضي الله عنها فقال زملوني زملوني,"Rasulullah repeated these words which made his heart tremble. He went to Khadijah bint Khuwaylid and said, “Cover me! Cover me!”"
819,فزملوه حتى ذهب عنه الروع فأخبر خديجة وقال لها: لقد خشيت على نفسي,"She then covered him with a blanket until the fear subsided. He related the whole incident said to her and said, “I feared for my life.”"
820,فقالت له خديجة: كلا لا يخزيك الله أبدا إنك تصل الرحم وتحمل الكل وتكسب المعدوم وتقوي الضعيف الضعيف وتعين على نوائب الدهر والحق,"“Never,” she replied, “Allah would never disgrace you. You maintain family ties; you support others; you give the destitute; you entertain guests; you help the afflicted ones and stand up for the sake of Truth.”"
821,وذكر الحديث بطوله,Qays then continued narrating the entire lengthy hadith.
822,قال رسول الله صلى الله عليه وسلم بينما أنا أمشي إذ سمعت صوتا من السماء فرفعت بصري فإذا أنا بالملك الذي جاءني بحراء وهو جالس على كرسي بين السماء والأرض فخشيت منه رعبا فرجعت إلى خديجة فقلت: دثروني دثروني,"Qays: Rasulullah said, “While I was walking I heard a voice from the sky. I raised my gaze and saw that same angel who had appeared before me in Hira. He was sitting on a chair hovering between the sky and Earth. I felt frightened and went to Khadijah and said to her, ‘Cover me! Cover me!’"
823,"فأنزل الله تعالى: {يَا أَيُّهَا الْمُدَّثِّرُ*قُمْ فَأَنْذِرْ} [المدثر: 1, 2]الاية",So Allah revealed:
824,ثم حمى الوحي وتتابع,Thereafterthe revelation came continuously.”
825,ولقد كنت معه يوما في المسجد إذ دخل رجل ومعه بعير له فأناخه بالباب وعقله ودخل وقال السلام عليكم فرددنا عليه السلام,I was with Rasulullah S in the Masjid one day when a man arrived. He made his camel sit and tied it. He then entered and made salam to which we replied.
826,فقال: أيكم محمد فقلنا هذا الأبيض الوجه فقال له الرجل: يا ابن عبد المطلب قد أتيت أسألك مشددا عليك فلا تجد علي في نفسك,Man: Who is Muhammad?
827,فقال له: سل عما بدا لك,Rasulullah: Ask what you wish to.
828,فقال بربك ورب من قبلك الله أرسلك إلى الناس كلهم كافة,"Man: In the name of your Rabb and the Rabb of those before you, did Allah send you to all mankind?"
829,قال انشدك بالله الله أمرك أن تصلي الصلوات الخمس في اليوم والليلة قال اللهم نعم,"Man: In Allah’s name, did Allah order you to pray five Salawat every day and night? Rasulullah: In Allah’s name, yes!"
830,قال: أنشدك بالله الله أمرك أن تصوم هذا الشهر من السنة فقال اللهم نعم,"Man: In Allah’s name, did Allah order you to fast this month every year?"
831,فقال أنشدك بالله الله أمرك أن تأخذ هذه الصدقة من أغنيائنا فتقسمها على فقرائنا فقال اللهم نعم,"Man: In Allah’s name, did Allah order you to take charity from our rich and distribute it amongst our poor?"
832,فقال الرجل: آمنت بما جئت به وأنا رسول من ورائي من قومي أنا ضمام بن ثعلبة أخو بني سعد بن بكر,"Man: I believe in what you have brought. I am my people’s messenger. I am Dammam bin Tha’labah, the brother of Banu Sa’d bin Bakr."
833,فقال هرقل: بحق دينك ما الذي رأيت من معجزاته,"Heraclius: I ask you in the name of your religion, what did you witness of his miracles?"
834,قال كنت معه في سفر فأقبل إليه أعرابي فدنا منه فقال له النبي صلى الله عليه وسلم: “أتشهد أن لا إله إلا الله وإني محمد رسول الله” قال الأعرابي: ومن يشهد بما تقول,"Qays: I was travelling with him when a Bedouin came to him. The Prophet said to him, “Will you bear witness that there is no deity besides Allah and that I, Muhammad, am the Messeneger of Allah?”"
835,فقال النبي صلى الله عليه وسلم: “هذه الشجرة” ثم أن النبي صلى الله عليه وسلم دعا الشجرة وهي بشاطىء الوادي فأقبلت إليه وهي تخط الأرض حتى قامت بين يديه فاستشهدها ثلاث مرات فقالت: أنت محمد رسول الله,"“That tree!” replied the Prophet and called the tree which was at the edge of the valley. It came streaking though the ground until it stood in front of him. He asked it three times to testify, so it said, “You are Muhammad Rasulullah.”"
836,ثم أمرها فرجعت إلى منبتها,Then upon his order it returned to its place.
837,فقال هرقل: أنا نجد في كتابنا أن الرجل من أمته إذا عمل السيئة كتبت عليه واحدة وأن عمل الحسنة كتبت له عشرا,"Heraclius: We find it written in our scriptures that if one of his followers commits an evil it is written against him as one, but if he does good it is written for him as ten."
838,قال قيس بن عاصم هذا في كتابنا قال الله تعالى: {مَنْ جَاءَ بِالْحَسَنَةِ فَلَهُ عَشْرُ أَمْثَالِهَا وَمَنْ جَاءَ بِالسَّيِّئَةِ فَلا يُجْزَى إِلَّا مِثْلَهَا} [الأنعام: 160],Qays : Allah says:
839,فقال هرقل: أعلم أن النبي صلى الله عليه وسلم الذي بشر به عيسى المسيح هو الشاهد على الناس يوم القيامة,Heraclius: I know that the prophet about whom Jesus prophesied will bear witness against the people on the Day of Judgement.
840,فقال قيس هوة نبينا قال الله تعالى في كتابه العزيز: {يَا أَيُّهَا النَّبِيُّ إِنَّا أَرْسَلْنَاكَ شَاهِداً وَمُبَشِّراً وَنَذِيراً*وَدَاعِياً} الآية,Qays: He is our Prophet S. Allah says:
841,أما شهادته في العقبي فهو قول ربنا في كلامه القديم: {وَجِئْنَا بِكَ عَلَى هَؤُلاءِ شَهِيداً} [النساء: 41],"As for his testimony on the day of Judgement, our Rabb says:"
842,فقال هرقل: إن الذي وصفته لك هو الذي يأمر العباد أن يمضوا إليه في حياته ويصلوا عليه في حياته وبعد وفاته,Heraclius: The one whom I describe to you is such that God orders His slaves to go to him during his lifetime and to convey salutations upon him both during his lifetime and after his demise.
843,فقال قيس هو نبينا صلىالله عليه وسلم,Qays: He is our Prophet S.
844,قال الله تعالى في كتابه العزيز: {إِنَّ اللَّهَ وَمَلائِكَتَهُ يُصَلُّونَ عَلَى النَّبِيِّ يَا أَيُّهَا الَّذِينَ آمَنُوا صَلُّوا عَلَيْهِ وَسَلِّمُوا تَسْلِيماً} [الأحزاب:56],Allah says: Fer//y v4//a/i and the angels convey salutations upon the Prophet. O you who believe! Convey salutations and salam upon him. [33:56]
845,قال هرقل: إن الذي وصفه المسيح يعرج به إلى السماء ويخاطبه العلي الأعلى,Heraclius: The one who has been described by Christ will ascend to the heavens where the Most High will speak to him.
846,فقال قيس هو والله نبينا صلى الله عليه وسلم قال الله تعالى في حقه: {سُبْحَانَ الَّذِي أَسْرَى بِعَبْدِهِ لَيْلاً مِنَ الْمَسْجِدِ الْحَرَامِ إِلَى الْمَسْجِدِ الْأَقْصَى} [الاسراء: 1].,Qays: By Allah! He is our Prophet Allah says:
847,قال الواقدي: وكان في ذلك الوقت بترك الروم وهو رأس دينهم جالسا يستمع هذا الكلام فالتفت هذا البترك إلى الملك وقال له: أيها الملك أن الذي ذكره عيسى لم يبعث بعده ولا قبله بل هي تآويل كاذبة,"The chief Patriarch of the Greek Orthodox Church who was the head of their religion was sitting and listening to this. He turned to Heraclius and said, “O Caesar, the one described by Jesus was not sent before him and has not yet been sent. This man is giving a false interpretation.”"
848,فقال ضرار بن الأزور كذبت في وجهك وكذبت هذه اللحية الملعونة المخزية يا كلب الروم أنت من أمثالك من يكذب عيسى عليه السلام وينكر بعث نبينا محمد عليه الصلاة والسلام أما تعلم أن عيسى قرأه في الإنجيل وموسى قرأه في التوراة وقرأه داود في الزبور,"Dirar: Lies drip from your face! This disgraceful, long-bearded man lies! O dog of Rome, it is you and your ilk who in reality deny both ‘Isa and Muhammad. Do you not know that ‘Isa read about him in the Gospels, that Musa read about him in the Torah, that Dawud read about him in the Psalms."
