,Arabic,English
0,طوق الحمامة في الأُلفَةِ والأُلَّاف تأليف علي بن حزم الأندلسي,The Ring of The Dove By IBN HAZAM
1,وبعد: عصمنا الله وإياك من الحيرة، ولا حمَّلنا ما لا طاقة لنا به، وقيَّض لنا من جميل عونه دليلًا هاديًا إلى طاعته، ووهبنا من توفيقه أدبًا صارفًا عن معاصيه، ولا وَكَلنا إلى ضعف عزائمنا، وخَوَر قُوانا، ووهاء بِنْيَتنا، وتلدُّد آرابنا، وسوء اختيارنا، وقلَّة تمييزنا، وفساد أهوائنا؛,"And next-may God preserve us and you from bewilderment, and may He not burden us with more than we can bear; may He of His goodly aid decree for us a guide to lead us into obedience of His Will, and bestow on us of His assistance some means that will draw us away and turn us from all offences against His commandments! May He not hand us over to our own weak resolves and feeble powers, the frailty of our physical frame and the confusion of our opinions, our evil choice, our little discretion, the corruption of our passions!"
2,مقدمة بِسْمِ الله الرَّحمَنِ الرَّحِيم وبه نستعين قال أبو محمد — عفا الله عنه: أفضل ما أبتدئ به حمد الله عزَّ وجلَّ بما هو أهله، ثم الصلاة على محمدٍ عبدِه ورسوله خاصةً، وعلى جميع أنبيائه عامةً،,"AUTHOR’S PREFACE In the Name of God the Merciful, the Compassionate THUS spoke Abu Muhammad, God forgive him: No better beginning can there be for my book than that I should praise Almighty God as He is worthy, and pray for His blessings upon Mohammed His servant and messenger in particular, and upon all His prophets in general."
3,ولقد أثبت الله بيننا من ذلك ما نحن عليه حامدون وشاكرون، وكانت معانيك في كتابك زائدة على ما عهدته من سائر كتبك، ثم كشفت إليَّ بإقبالك غرضك، وأطلعتني على مذهبك، سجيةً لم تزل علينا من مشاركتك لي في حلوك ومرك، وسرك وجهرك، يحدوك الودُّ الصحيح الذي أنا لك على أضعافه، لا أبتغي جزاءً غير مقابلته بمثله.,"Such is the attachment, which God has established between us, and for this we praise Him and give Him thanks. In the aforesaid letter you expressed ideas exceeding what I was accustomed to find in your other communications. Then on your arrival you revealed your intention plainly to me, and informed me of your views with that frankness which has always characterized our relations, that habit of sharing with me your every sweetness and bitterness, your every private thought and public profession. In this you were led by true affection, the which I doubly reciprocate, desiring no other recompense but to receive a like return."
4,وفي ذلك أقول مخاطبًا لعبيد الله بن عبد الرحمن بن المغيرة بن أمير المؤمنين الناصر — رحمه الله — في كلمة لي طويلة، وكان لي صديقًا:,"It was upon this theme that I composed the following verses in a long poem addressed to ‘Ubaid Allah Ibn `Abd al-Rahman Ibn al-Mughira, great-grandson of the Caliph al-Nasir (God have mercy upon him!), who was a dear friend of mine."
5,أَوَدُّكَ وُدًّا لَيْسَ فِيهِ غَضَاضَةٌ *** وَبَعْضُ مَوَدَّاتِ الرِّجَالِ سَرَابُ وَأَمْحَضْتُكَ النُّصْحَ الصَّرِيحَ وَفِي الحَشَى *** لِوُدِّكَ نَقْشٌ ظَاهِرٌ وَكِتَابُ فَلَوْ كَانَ فِي رُوحِي هَوَاكَ اقْتَلَعْتُهُ *** ومُزِّق بِالكَفَّيْنِ عَنْهُ إِهَابُ وَمَا لِيَ غَيْرُ الوُدِّ مِنْكَ إِرَادَةٌ *** وَلَا فِي سِوَاهُ لِي إِلَيْكَ خِطَابُ إِذَا حُزْتهُ فَالأَرْضُ جَمْعَاءُ وَالوَرَى *** هَبَاءٌ وَسُكَّانُ البِلَادِ ذُبَاب,"The passions most men boast them of Are like a desert’s noontide haze: I love thee with a constant love Unwithering through all my days.  This fondness I profess for thee Is pure, and in my heart I bear True love’s inscription plain to see, And all its tale is written there.  Had any passion, thine beside, At any time my soul possessed, I would have torn my worthless hide And plucked that alien from my breast.  There is no other prize I seek: Thy love is my desire sincere: Only upon this theme I speak To capture thy complacent ear.  This if I win, the earth’s expanse, And all mankind, are but as dust, Yea, the wide world’s inhabitants Are flies that crawl upon its crust."
6,فإن كتابك وردني من مدينة المريَّة إلى مسكني بحضرة شاطِبةَ تَذكُر من حسن حالك ما يسرُّني، وحَمدتُ اللهَ عز وجل عليه، واستدمتُه لك، واستزدتُه فيك، ثم لم ألبثْ أن اطلع عليَّ شخصُك، وقصدتني بنفسك، على بُعد الشُّقة، وتنائي الديار، وشَحط المزار، وطول المسافة، وغَوْل الطريق.,"Your letter came down to me from the city of Almeria to my dwelling-place in the Court of Jativa, in which you gave me joyous news of your well-being: I thanked God for this, and prayed to Him that he should continue it so, and grant you increase of your prosperity. Thereafter a little while and I beheld you in person, for you yourself sought me out despite the far distance, the vast sundering of our abodes the one from the other, the remoteness of the place of visitation, the great length of the space to be traversed, and the terror of the journey;"
7,وكلَّفتني — أعزَّك الله — أن أصنِّف لك رسالةً في صفة الحب ومعانيه، وأسبابه وأعراضه، وما يقع فيه وله على سبيل الحقيقة لا مُتزيِّدًا ولا مفننًا، لكنْ مُوردًا لما يحضُرني على وجهه وبحسب وقوعه، حيث انتهى حفظي وسَعة باعي فيما أذكره، فبدرتُ إلى مرغوبك.,"You charged me -may God exalt you!- Dto compose for you an essay describing Love, wherein I should set forth its various meanings, its causes and accidents, and what happens in it and to it, after the way of truth, neither adding anything nor embroidering anything, but only setting down exactly what I have to tell according to the manner of its occurrence, and mentioning all to the full extent of my recollection and the limit of my capacity. I have accordingly hastened to fulfill your desire;"
8,ولولا الإيجاب لك لما تكلَّفته، فهذا من الفقر، والأَوْلى بنا مع قِصر أعمارنا ألَّا نَصرفها إلا فيما نرجو به رَحْب المُنقلب وحُسن المآب غدًا.,"though but for the wish to comply with your commission I would never have undertaken it at all, being too poverty-stricken to attempt so great a task. Indeed, it behoves us rather, considering the brief duration of our lives, not to expend them save upon those enterprises which we may hope will secure for us a spacious destination and. a fair homecoming upon the morrow."
9,وإن كان القاضي حمام بن أحمد حدَّثني عن يحيى بن مالك عن عائذ، بإسناد يرفعه إلى أبي الدرداء أنه قال: «أجمُّوا النفوس بشيء من الباطل ليكون عونًا لها على الحق.»,"Yet it is true that Cadi Humam Ibn Ahmad has informed me on the authority of Yahya Ibn Malik, who had it from ` A’idh upon a chain of authority mounting to Abu ‘l-Darda’, that the latter said, “Recreate your souls with a little vanity, that it may the better aid them to hold fast to the truth.”"
10,ومن أقوال الصالحين من السلف المرضيِّ: «مَن لم يحسن يتفتَّى لم يحسن يتقوَّى.»,"A righteous and well-approved father of the faith declared, “The man who has never known how to comport himself as a cavalier will never know how to be truly god fearing.”"
11,وفي بعض الأثر: «أريحوا النفوس؛ فإنها تصدأ كما يصدأ الحديد.»,"The Prophet is reported to have said, “Rest your souls from time to time: they are apt to rust, in the same way that steel rusts.”"
12,والذي كلَّفتني لا بد فيه من ذكر ما شاهدتْه حضرتي، وأدركته عنايتي، وحدَّثني به الثقات من أهل زمانه، فاغتفرْ لي الكناية عن الأسماء؛ فهي إما عورة لا نَستجيز كشفها، وإما نُحافظ في ذلك صديقًا ودودًا، ورجلًا جليلًا.,"In performing this task with which you have charged me I must perforce relate such things as I ‘have personally witnessed, or what I have discovered by diligent research, or matters communicated to me by reliable informants of my own times. Pray excuse me if I sometimes do no more than hint at the names of the heroes, of my anecdotes, and do not mention them more explicitly; this is due either to some shame which I do not hold it permissible to uncover, or in order to protect a loving friend or an illustrious man."
13,وبحسبي أن أُسمي من لا ضرر في تسميته، ولا يَلحقنا والمسمَّى عيبٌ في ذكره، إِما لاشتهارٍ لا يُغني عنه الطيُّ وتركُ التبيين، وإما لرضًى من المُخبَر عنه بظهور خبره وقلةِ إنكارٍ منه لنقله.,"It will suffice me to name only those the naming of whom does no harm, and whose mention brings no opprobrium either upon ourselves or them; either because the affair is so notorious that concealment and the avoidance of clear specification will do the party concerned no good, or for the simple reason that the person being reported on is quite content that his story should be made public, and by no means disapproves of its being bandied about."
14,وسأورد في رسالتي هذه أشعارًا قلتُها فيما شاهدته، فلا تنكر أنت ومن رآها عليَّ أني سالكٌ فيها مسلك حاكي الحديث عن نفسه، فهذا مذهب المتحلِّين بقول الشعر، وأكثر من ذلك فإنَّ إخواني يجشِّموني القولَ فيما يَعْرِض لهم على طرائقهم ومذاهبهم. وكفاني أني ذاكر لك ما عَرض لي مما يشاكل ما نحوتُ نحوه وناسبُه إليَّ.,"I shall be quoting in this essay verses which I have composed myself upon my own observations. Do not take it amiss, my friend, or whoever else may happen to see this volume, that I am here following the fashion of those who always quote themselves in their stories; such is the way of men who affect the writing of poetry. Moreover, my friends make me shy to write about their adventures after their own private ways and habits; so I have been satisfied to mention here only what has occurred to me, within the terms of reference you have prescribed, in every case attributing the incident to myself."
15,والتزمت في كتابي هذا الوقوفَ عند حدك، والاقتصارَ على ما رأيتُ أو صحَّ عندي بنقل الثقات، ودعني من أخبار الأعراب والمتقدمين؛ فسبيلُهم غير سبيلنا، وقد كثرت الأخبار عنهم، وما مذهبي أن أنضي مطيَّة سواي، ولا أتحلَّى بحلي مستعار.,"I have kept in this book to the bounds set by you, limiting myself to things which I have either seen with my own eyes, or I am convinced are true as deriving from trustworthy reporters. Spare me those tales of Bedouins, and of lovers long ago! Their ways were not our ways, and the stories told of them are too numerous in any case. It is not my practice to wear out anybody’s riding-beast but my own; I am not one of those who deck themselves up in borrowed plumes."
16,والله المستغفَر والمستعان لا ربَّ غيره.,In all this I ask God’s forgiveness and succour; there is no Lord beside Him.
17,باب وقسمت رسالتي هذه على ثلاثين بابًا، منها في أصول الحب عشرة؛ فأولها هذا الباب، ثم باب في علامات الحب، ثم باب فيه ذكر من أحب في النوم، ثم باب فيه ذكر من أحب بالوصف، ثم باب فيه ذكر من أحب من نظرة واحدة، ثم باب فيه ذكر من لا تصح محبته إلا مع المطاولة، ثم باب التعريض بالقول، ثم باب الإشارة بالعين، ثم باب المراسلة، ثم باب السفير.,"PRELIMINARY EXCURSUS I HAVE divided this treatise into thirty chapters. Of these, ten are concerned with the root-principles of Love, the first being the immediately following chapter on the Signs of Love. After this comes a chapter on Those who have fallen in Love while Asleep; then a chapter on Those who have fallen in Love through a Description; next a chapter on Those who have fallen in Love at First Sight; a chapter on Those whose Love has only become True after Long Association; a chapter on Allusion by Words; a chapter on Hinting with the Eyes; a chapter on Correspondence; and lastly (of these first ten) a chapter on the Messenger."
18,ومنها في أعراض الحب وصفاته المحمودة والمذمومة اثنا عشر بابًا، وإن كان الحب عَرضًا والعرض لا يحتمل الأعراض، وصفةً والصفةُ لا تُوصف؛ فهذا على مجاز اللغة في إقامة الصفة مقام الموصوف،,"The second section of the book comprises twelve chapters on the accidents of Love, and its praiseworthy and blameworthy attributes. (Here I should remark in parenthesis that Love is in fact an accident, and as such cannot properly be said itself to be susceptible to accidents; Love is an attribute, and attributes may riot be further qualified. I am therefore speaking metaphorically in discussing Love’s accidents and attributes, putting the attribute itself in the place of the thing qualified thereby."
19,وعلى معنى قولنا: وجودنا عرضًا أقل في الحقيقة من عرض غيره، وأكثر وأحسن وأقبح في إدراكنا لها، علمنا أنها متباينة في الزيادة والنقصان من ذاتها المرئية والمعلومة؛ إذ لا تقع فيها الكمية ولا التجزي، لأنها لا تشغل مكانًا،,"When we say and feel that one accident is greater or smaller, more beautiful or uglier in reality than another accident, according to our apprehension of that reality, we recognize that accidents differ from each other, in terms of excess or deficiency, in respect only of their visible and knowable essence; there is no question of numerical quantity or physical partition being relevant to them, seeing that they do not occupy any space.)"
20,وهي: باب الصديق المساعد، ثم باب الوصل، ثم باب طي السر، ثم باب الكشف والإذاعة، ثم باب الطاعة، ثم باب المخالفة، ثم باب من أحب صفةً لم يُحب بعدها غيرها مما يخالفها، ثم باب القنوع، ثم باب الوفاء، ثم باب الغدر، ثم باب الضنى، ثم باب الموت.,"This section is made up first of a chapter on the Helping Friend, then a chapter on Union, then a chapter on Concealing the Secret, and after that chapters on Revealing and Divulging the Secret, on Compliance, and on Opposition; a chapter on Those who have fallen in Love with a certain Quality and thereafter have not loved any other different to it; and chapters on Fidelity, on Betrayal, on Wasting Away, and on Death."
21,ومنها في الآفات الداخلة على الحب ستة أبواب، وهي: باب العاذل، ثم باب الرقيب، ثم باب الواشي، ثم باب الهجر، ثم باب البين، ثم باب السلو.,"In the third part of the essay there are six chapters on the misfortunes which enter into Love. These chapters deal respectively with the Reproacher, the Spy, the Slanderer, Breaking Off, Separation, and Forgetting."
22,ومن هذه الأبواب الستة بابان لكل واحد منهما ضد من الأبواب المتقدمة الذكر، وهما: باب العاذل، وضده باب الصديق المساعد؛ وباب الهجر، وضده باب الوصل؛ ومنها أربعة أبواب لا ضد لها من معاني الحب، وهي: باب الرقيب، وباب الواشي، ولا ضد لهما إلا ارتفاعهما.,"Two of these six chapters are matched each with a corresponding chapter (of those already mentioned) on an opposite subject: the chapter on the Reproacher is paired with the, chapter on the Helping Friend, and the chapter on Breaking Off complements the chapter on Union. The other four have no contrasting themes in Love’s repertory. The chapters on the Spy and the Slanderer have no opposites, except their removal altogether."
23,وحقيقة الضد ما إذا وقع ارتفع الأول، وإن كان المتكلمون قد اختلفوا في ذلك. ولولا خوفنا إطالة الكلام فيما ليس من جنس الكتاب لتقصيناه.,"The real nature of opposites is that when the opposite to a given condition occurs, the original state is removed, however much the schoolmen may have differed in their views of the matter; we would have thrashed the question out thoroughly, but for the fear of dilating at too great length upon a topic not absolutely material to the present book."
24,وباب البين وضده تصاقب الديار؛ وليس التصاقب من معاني الحب التي نتكلم فيها، وباب السلو، وضده الحب بعينه؛ إذ معنى السلو ارتفاع الحب وعدمه.,"As for the Chapter on Separation, its true opposite would be contiguity of dwellings; but contiguity is not one of the themes of Love, which we are at present engaged in discussing. And the opposite of the chapter on Forgetting is really Love itself, since forgetting means the removal and non-existence of Love."
25,ومنها بابان ختمنا بهما الرسالة؛ وهما: باب الكلام في قبح المعصية، وباب في فضل التعفف، ليكون خاتمةَ إيرادنا وآخرَ كلامنا الحضُّ على طاعة الله عز وجل، والأمر بالمعروف والنهي عن المنكر؛ فذلك مُفترضٌ على كل مؤمن.,"Finally come two chapters to terminate the discourse a chapter discussing the Vileness of Sinning, and a chapter on the Virtue of Continence. I have planned the matter thus so that the conclusion of our exposition and the end of our discussion may be an exhortation to obedience to Almighty God, and a recommendation to do good and to eschew evil; which last commandment is indeed a duty imposed upon all believers."
26,لكنا خالفنا في نَسق بعض هذه الأبواب هذه الرُّتبة المقسمة في دَرج هذا الباب الذي هو أول أبواب الرسالة، فجعلناها على مباديها إلى منتهاها واستحقاقها في التقدم والدرجات والوجود، ومن أول مراتبها إلى آخرها، وجعلنا الضد إلى جنب ضده؛ فاختلف المساق في أبواب يسيرة. والله المستعان.,"Notwithstanding all, this, in setting out certain of these chapters we have in fact varied the order apportioned in the course of this opening chapter of the treatise. We have arranged them serially from the beginning to the conclusion of the story according to there due right of precedence, their gradations, and their actuality, proceeding methodically from the first degree to the last. We have also placed each pair of opposites side by side; as a result, the proper sequence has been departed from in a few chapters. I ask God’s help again."
27,وهَيْئتُها في الإيراد أولُها هذا الباب الذي نحن فيه، وفيه صدر الرسالة، وتقسيم الأبواب، والكلام في باب ماهية الحب، ثم باب علامات الحب، ثم باب من أحب بالوصف، ثم باب من أحب من نظرة واحدة، ثم باب من لا يحب إلا مع المطاولة، ثم باب من أحب صفة لم يحب بعدها غيرها مما يخالفها، ثم باب التعريض بالقول، ثم باب الإشارة بالعين، ثم باب المراسلة، ثم باب السفير، ثم باب طي السر، ثم باب إذاعته، ثم باب الطاعة، ثم باب المخالفة، ثم باب العاذل، ثم باب المساعد من الإخوان، ثم باب الرقيب، ثم باب الواشي، ثم باب الوصل، ثم باب الهجر، ثم باب الوفاء، ثم باب الغدر، ثم باب البين، ثم باب القنوع، ثم باب الضنى، ثم باب السلو، ثم باب الموت، ثم باب قبح المعصية، ثم باب فضل التعفف.,"My actual disposition of the material is therefore as follows. I have placed first and foremost this chapter in the middle of which we now are; it comprises the preliminary excursus, the division of the chapters, and a discourse on the Nature of Love. This is followed by the chapter on the Signs of Love; then the chapter on Those who have fallen in Love through a Description; then the chapter on Those who have fallen in Love at First Sight; then the chapter on Those who have only fallen in Love after Long Association; then the chapter on Those who have fallen in Love with a certain Quality and thereafter have not loved any other different to it; then the chapter on Allusion by Words; then the chapter on Hinting with the Eyes; then the chapter on Correspondence ; then the chapter on the Messenger ; then the chapter on Concealing the Secret; then the chapter on Divulging the Secret; then the chapter on Compliance; then the chapter on Opposition; then the chapter on the Reproacher; then the chapter on the Helpful Brother; then the chapter on the Spy; then the chapter on the Slanderer; then the chapter on Union; then the chapter on Breaking Off ; then the chapter on Fidelity; then the chapter on Betrayal then the chapter on Separation; then the chapter on Contentment; then the chapter on Wasting Away; then the chapter on Forgetting; then the chapter on Death; then the chapter on the Vileness of Sinning; and lastly the chapter on the Virtue of Continence."
28,الكلام في ماهية الحب,Of the Nature of Love
29,الحب — أعزك الله — أوله هَزل وآخره جِد، دقَّت معانيه لجلالتها عن أن تُوصف، فلا تُدرك حقيقتها إلا بالمعاناة، وليس بمُنكَر في الديانة، ولا بمحظور في الشريعة؛ إذ القلوب بيد الله عز وجل.,"Of Love -may God exalt you!- the first part is jesting, and the last part is right earnestness. So majestic are its divers aspects, they are too subtle to be described; their reality can only be apprehended by personal experience. Love is neither disapproved by Religion, nor prohibited by the Law; for every heart is in God’s hands."
30,وقد أحب من الخلفاء المهديين والأئمة الراشدين كثير، منهم بأندلسنا عبد الرحمن بن معاوية لدَعجاء، والحَكَم بن هشام، وعبد الرحمن بن الحكم وشغفهُ بطروب أُم عبد الله ابنه أشهرُ من الشمس، ومحمد بن عبد الرحمن وأمره مع غزلان أم بنيه عثمان والقاسم والمطرف مَعلوم، والحكم المستنصر وافتتانُه بصبح أم هشام المؤيَّد بالله — رضي الله عنه وعن جميعهم — وامتناعُه عن التعرُّض للولد من غيرها، ومثل هذا كثير.,"Many rightly guided caliphs and orthodox imams have been lovers. Of those who have lived in our beloved Andalusia I may mention `Abd al-Rahman Ibn Mu’awiya, the lover of Da`ja; al-Hakam Ibn Hisham; `Abd al-Rahman Ibn al-Hakam, whose passion for Tarub the mother of his son `Abd Allah is more famous among men than the very sun itself; Muhammad Ibn `Abd al-Rahman, well-known admirer of Ghizlan who bore him ‘Uthman, al-Qasim and al-Mutarrif; and Al-Hakam al-Mustansir, adorer of Subh mother of Hisham al-Mu’aiyad Billah, who refused to interest himself in any other child but hers. Such instances are extremely numerous;"
