,Arabic,English
1125,ودفع الكتاب إلى علي فقرأه على المسلمين إلى آخره قال زيد بن وهب ثم رأيت عمر قد هدا من بكائه وقد زاد فرحه وأقبل علي وقال: يا زيد إذا عدت فأمعن النظر في اتيانها وأعنا بها واحمد الله كثيرا,"He then gave the letter to ‘Ali who read it out to the Muslims. I then saw ‘Umar’s crying cease. He turned to me in joy and said, “O Zayd, when you return to Antioch enjoy her figs and apples to the full and praise Allah excessively.”"
1126,فقلت: يا أمير المؤمنين ليس هذا أوانه,"“O Commander of the Believers,” I replied, “This is not the season!”"
1127,قال ثم جلس عمر على الأرض ودعا بدواة وقرطاس وكتب إلى أبي عبيدة كتابا يقول فيه:,He then sat down on the ground and called for an ink-pot and paper and wrote as follows to Abu ‘Ubaydah
1128,بسم الله الرحمن الرحيم,"In the name of Allah, the Most Gracious, the Most Merciful."
1129,من عبد الله عمر إلى عامله بالشام أبي عبيدة عامر ابن الجراح,"From: Allah’s slave, ‘Umar"
1130,سلام عليك وإني أحمد الله الذي لا إله إلا هو وأصلي على نبيه وأشكره على ما وهب من النصر للمسلمين وجعل العاقبة للمتقين ولم يزل بنا لطيفا معينا وأما قولك لم نقم بانطاكية لطيبها فإن الله عز وجل لم يحرم الطيبات على المؤمنين الذين يعملون الصالحات,Salam ‘alayka
1131,فقال: {يَا أَيُّهَا الرُّسُلُ كُلُوا مِنَ الطَّيِّبَاتِ وَاعْمَلُوا صَالِحاً} [المؤمنون: 51],"He says, O Messengers! Eat of the pure pleasant things and perform pious acts. [23:51]"
1132,وقال: {يَا أَيُّهَا الَّذِينَ آمَنُوا كُلُوا مِنْ طَيِّبَاتِ مَا رَزَقْنَاكُمْ وَاشْكُرُوا الِلَّهِ} [البقرة: 172] الآية,O you who believe! Eat of the pure pleasant things which We have provided you with and be grateful to Allah. [2:172]
1133,فكان يجب عليك أن تريح المسلمين من تعبهم وتدعهم يرغدون في مطعمهم ويريحون أبدانهم من نصب القتال مع من كفر بالله,It was therefore compulsory upon you to let the Muslims rest from their fatigue. You had to leave them to eat well and rest their bodies from the tiredness of battle against those who deny Allah.
1134,وأما قولك إنك منتظر أمري فالذي آمرك به أن تدخل وراء العدو وتفتح الدروب فإنك الشاهد وأنا الغائب وقد يرى الشاهد ما لا يراه الغائب وأنت بحضرة عدوك وعيونك تأنيك بالأخبار,As for my order which you are waiting for – go behind the enemy and conquer the mountain-passes. You are present while I am absent. The present sees that which the absent does not see. You are present by the enemy and your spies bring you intelligence.
1135,فإن رأيت أن دخولك إلى الدروب بالمسلمين صواب فابعث إليهم بالسراية وادخل معهم إلى بلادهم وضيق عليهم المسالك ومن طلب منك الصلح فصالحهم ووف لهم بما تقدر,"If you see that for the Muslims to cross the passes is the correct thing to do, then enter their territory and make all roads narrow for them. Grant terms to whoever seeks a treaty with you and fulfil them to the best of your ablility."
1136,وأما قولك أن العرب أبصرت نساء الروم فرغبت في التزوج فمن أحب ذلك فدعه أن لم يكن له أهل بالحجاز ومن أراد أن يشتري الأماء فدعه فإن ذلك أصون لفروجهم واعف لنفوسهم,As for the Arabs who want to marry Roman women – permit them only if they have no family back in al-Hijaz. Allow anyone to buy slave-girls because that will protect their chastity.
1137,وما تحتاج أن أوصيك في أمر فلنطانوس صاحب رومية اوسع عليه في النفقة وعلى من معه فإنه قد فارق أهله وملكه وأمره ونهيه,"I instruct you to generously spend on Falantius, prince of Rumiyah, and his men. He has given up his family and power."
1138,والسلام عليك وعلى جميع المسلمين,Peace be upon you and all the Muslims.
1139,وطوى الكتاب ودفعه لزيد بن وهب وقال له: انطلق رحمك الله وأشرك عمر في ثوابك,"He folded the letter and gave it to me, saying, “May Allah have mercy on you! Go and make ‘Umar your partner in divine reward.”"
1140,فأخذ زيد الكتاب وهم أن يسير فأمره أن يقف وقال له: على رسلك حتى يزودك عمر من قوته,"I took the letter and was about to depart when he said, “Wait until ‘Umar supplies you with some of his food.”"
1141,ثم أن عمر أناخ راحلته وأخرج له تمرا وأعطاه صاع تمر وصاع سويق وقال: يا زيد اعذر عمر فهذا ما أمكنه,"He made his camel sit and gave me one Sa’ (3.2 or 2.1 kg) of dates and one Sa’ of sawiq cereal, saying, “O Zayd, excuse ‘Umar for this is all he can spare.”"
1142,ثم أن عمر قبل راس زيد بن وهب فبكى زيد وقال: يا أمير المؤمنين أو بلغ من قدري أن تقبل راسي وأنت أمير المؤمنين وصاحب سيد المرسلين وقد ختم الله بك الأربعين,"Then when he kissed my head I wept and said, “O Commander of the Believers, it is above my station to be kissed by you when you are the Commander of the Believers, a Sahabi of the master of all Messengers and through you Allah completed the number of Muslims at forty.”"
1143,فبكى عمر وقال أرجو أن يغفر الله لعمر بشهادتك,"He wept and said, “I can but hope that Allah will forgive me through your testimony.”"
1144,قال زيد بن وهب فاستويت على كور ناقتي وهممت بالمسير فسمعته يقول: اللهم احمله عليها بالسلامة واطو له البعيد وسهل له القريب إنك على كل شيء قدير,"As I mounted my she-camel I heard him saying, “O Allah, let him mount with safety. Fold up the distances for him. Make the near distances easy for him. Verily You have power over everything.”"
1145,قال زيد بن وهب ففرحت بدعوة عمر رضي الله عنه وعلمت أن الله لا يرد دعوته إذ كان لربه طائعا ولنبيه تابعا فجعلت اسير والأرض تطوي لي تحت اخفاف مطيتي فكنت والله في اليوم الثالث عند أبي عبيدة وقد رحل عن انطاكية وقد نزلت على حازم قال زيد فلما وصلت إلى عساكر المسلمين سمعت ضجة وجلبة وقد ارتفعت الأصوات فسألت رجلا من أهل اليمن ما سبب ذلك,"I was delighted at his du’a for me. I knew that his du’a was never rejected because he was obedient to his Rabb and followed His Prophet. I travelled the Earth which folded up beneath the hooves of my mount until (and swear this by Allah!) I reached Abu ‘Ubaydah on the third day. He had left Antioch and was camped at Hazim. As I reached the Muslim camp I heard a great deal of noise so I asked a man from Yaman, “What is the cause of this?”"
1146,قال فرحا بما فتح الله على المسلمين,"“Joy at the victories Allah has granted to the Muslims,” he replied."
1147,وهذا خالد قد أتى وكان قد ضرب على شاطىء الفرات وأغار بخيله وقد صالحه أهل منبج وبزاعة وبالس وأتى برجالهم وأموالهم وافتتحها صلحا وقد فتح منبج وبزاعة وبالس وقلعة نجم في العشر الأوسط من المحرم سنة ثماني عشرة من الهجرة وصالحهم بعد رد أموالهم على مائة ألف وخمسين ألف دينار وأخذها بعد أن نزل صاحبهم جرفناس وسار بأمواله وعبيده وخيوله,Al-Waqidi narrates:
1148,إلى بلاد الروم وولى على منبج عباد ابن رافع التيميي وعلى الجسر نجم بن مفرج وولى على بزاعة اوس بن خالد الرابعي وعلى بالس بادر بن عوف الحميري وبنى له بها قلعة إلى جانب بالس من الشرق وسماها باسمه وعاد خالد بالأموال والأثقال يوم قدوم زيد بن وهب,"Khalid appointed ‘Abbad bin Rafi’ at-Tamimi over Manbij; Najm bin Mafrah over al-Jisr; ‘Aws bin Khalid ar-Raba’i over Baza’ah and Badir bin ‘Awf al-Himyari over Balis. Badir built a fort to the east of Balis and named it, Badir, after himself. Khalid returned with all that wealth on the day Zayd returned."
1149,قال فأتيت أبا عبيدة وهو جالس وخالد إلى جانبه وقد قدم مال الصلح فانحت ناقتي وسلمت عليهم ودفعت الكتاب إلى ابي عبيدة ففضه وقراه على المسلمين,Zayd bin Wahb narrates:
1150,فلما سمعت المسلمون ما فيه قال أبو عبيدة: معاشر المسلمين أن أمير المؤمنين قد جعل أمر الدخول إلى الدروب الي وقال أنت الشاهد وأنا الغائب وأنا لا أفعل شيئا إلا برأيكم فما تشيرون علي أن أفعل رحمكم الله,"He then said, “O Muslims, the Commander of the Believers has given me the option of crossing the mountain-passes because he says that I am present while he is absent. Since I do not decide anything without consulting with you I now ask for your advice. May Allah have mercy on you.”"
1151,فلم يجبه أحد وأعاد القول ثانيا فلم يجبه أحد,"Nobody replied so he repeated his question.They still remained silent,"
1152,والله أعلم.,سقطمن النسخة
1153,فقال ابو عبيدة معاشر المسلمين هذا الشام قد ملكتموه وملككم الله إياه واخرج عدوكم منه بالذل والهوان وأورثكم أرضهم وديارهم كما قال الله تعالى في كتابه العزيز فما تشيرون به علي اندخل في هذه الدروب وراء اعدائنا,"so he said, “O Muslims, you now rule this land of Syria which Allah has granted to you. He has expelled your enemy therefrom in humiliation and made you the inheritors of the land and buildings as he promised in His Honoured Book. What do you advise me with? Do we cross the mountain-passes into enemy territory?”"
1154,فلم يجبه احد فأعاد الكلام ثم قال: ما هذا السكوت أفشل بكم بعد الشجاعة أم كسل بعد النشاط أم قد انتقيتم من الحسنات ولم يبق عليكم من الذنوب وإن الحسنات لكم كثيرة ولم يبق عليكم خطيئة فالرغبة إلى الله أن يعينكم على الجهاد فهو خير لكم من الدنيا وما فيها,"They still remained silent so he repeated his question and said, “What is this silence for? Have you become cowards after having been brave or have you become lazy after having been energetic? Or have you become so pure that not a trace of sin remains on you and you have accumulated so much virtue that no mistake remains against you? It should then be expected that Allah will help you in Jihad which is better for you than the world and all it contains.”"
1155,قال فكان أول من تكلم ميسرة بن مسروق العبسي فقال: أيها الأمير أنا لم نسكت لجزع لحقنا ولا لفزع رهقنا وإنما بعضنا ينتظر بعضا اجلالا وأدبا وأعلم أيها الأمير أنه ما لنا تجارة ولا عمل غير الجهاد في أعداء الله وها نحن لك وبين يديك ومنك الأمر ومنا الطاعة لله ولرسوله ولك وأما أنا فلا أملك إلا نفسي فوجهني حيث شئت تجدني طائعا,"Maysarah bin Masruq: O commander, we do not remain silent out of cowardice but await someone else to reply out of mutual respect. We have no other business except for Jihad against Allah’s enemies. We are here before you. It is for you to order us and for us to obey Allah, His Rasul and you. I can only speak for myself and not others. Send me wherever you please, you will find me to be obedient."
1156,فقال أبو عبيدة معاشر المسلمين من له راي وحضرته مشورة فليقلها ويظهر ما عنده,AM ‘Ubaydah: Whoever wishes to express an opinion should do so.
1157,فقال خالد: أيها الأمير أن إقامتنا عن طلب القوم وهن وعجز منا في ديننا وطلبهم هو الغنيمة والنصر من عند الله والذي أشير به أيها الأمير أن تبعث الجيوش في كل درب من هذه الدروب فإن ذلك يوهن العدو وتقر به أعين المسلمين,"Khdlid: O commander, staying back from the enemy is just plain weakness from our side. If we go after them we will obtain booty. Victory is of course from Allah. I suggest that you send armies through every single mountain-pass. This will weaken the enemy and comfort the Muslims."
1158,قال فجزاه أبو عبيدة خيرا وقال: يا أبا سليمان إني قد رأيت أن أعقد لميسرة عقدا واسير معه رجالا لانه هو أول سارع إلى هذا الأمر وأشار به فيفتح الله لهم الدروب ويغير على ما من قرب من البلاد ويرجع فيخبرنا عن خبر البلاد فنعمل على حسب ما نرى.,"Abu ‘Ubaydah: May Allah reward you well, Abu Sulayman. I want to tie a flag for Maysarah and despatch him with an army because he hastened to this matter and pointed it out. May Allah open up the passes for them so that they can raid the nearby lands and return to tell us about the territory. We can then act upon their news."
1159,فقال خالد: هذا الصواب فعقد لميسرة وانتخب له من القبائل ثلاثة آلاف فارس من الشجعان وألف عبد من السودان وجعل من كل قبيلة نقيبا وجعل على العبيد دامساأبا الهول,Khdlid: That is correct.
1160,قال فلبسوا اكمل السلاح وكل منهم يقول أنه يلقي الكتيبة وحده وجعل أمير القوم ميسرة وقال أبو عبيدة يا أبا الهول كن انت بجماعتك في أوائل العسكر ولا تخالف ميسرة فيما اشار به فإنه مبارك الطلعة.,"They armed themselves heavily, each one saying that he was enough to take on an entire squadron on his own. Abu ‘Ubaydah then said to Damis, “O Abu al-Hawl, your group will form the vanguard. Do not oppose Maysarah in anything he may tell you because he is a blessed scout.”"
1161,فقال سمعا وطاعة.,"“I hear and obey,” replied Damis."
1162,قال: وجهز القوم ثم أن خالدا قال: أيها الأمير أرسل معهم أدلاء يعرفونهم الطريق ويكونون لهم عيونا على أعدائهم.,"As the army began its preparations, Khalid said, “O commander, send guides with them to show them the way and spy on their enemies.”"
1163,فطلب لهم من أهل حلب من المعاهدين من يكون ناصحا لهم فاختاروا لهم اربعة واعطاهم أبو عبيدة واحسن إليهم وطرح عنهم الجزية وقال لهم: في أي درب يكون دخول المسلمين في طلب العدو.,"The Christian allies of Aleppo were asked to volunteer guides who would act for the good of the Muslims. The Aleppans chose four of them whom Abu ‘Ubaydah rewarded. He acted kindly towards them and commuted their Jizyah. He then asked them, “Which pass should the Muslims cross to get to their enemy?”"
1164,فاجتمع رأيهم على أن يدخلوا في الدرب الاعظم من بلد قورص.,"They all agreed on entering the largest pass through the land of Quras and said, “O commander, these passes are nothing like the lands you have conquered. They are icy cold, dense with trees and filled with stones and mud. There are many valleys, gorges, glens, passes and caves.”"
1165,فقال أهل اليمن سيروا أنتم أمامنا فإنكم ترون منا عجبا.,"The Yamanis retorted, “You simply go ahead of us. You will see us performing amazing feats.”"
1166,فسار أبو الهول والمعاهدون أمامه وسار ميسرة في أعقابهم بعدما ودعوا الناس ومضوا وهم بالتهليل والتكبير وقراءة القرآن والمسلمون يدعون لهم بالنصر والسلامة.,Damis then left with the guides in front of him and Maysarah behind him. They bade the people farewell and left reciting the Quran and “La ilaha illallah! Allahu Akbar!” the Muslims made du’a for their safety and victory.
1167,قال عطاء بن جعيدة وسرنا والدليل أمامنا حتى أتينا عقبة حنداس فقطعناها وعبرنا نحو الساجور وأتينا قورص فنزلنا فيها وبتنا فلما أصبحنا ودخلنا الدروب وجدنا بها ارضا وعرة وأشجارا ومياها جارية ومضايق ليس للفرس فيها مجال فهالنا وحشة ذلك المكان إذ ليس للعرب فيه مجال ولا فسحة.,‘Ata bin Ja’idah narrates:
1168,فقلت في خاطري أن طالت علينا هذه الاودية خشيت على المسلمين أن يظفر بهم عدوهم.,"I thought, “If these valleys end up being long then I fear that the enemy will overpower the Muslims.”"
1169,والادلاء أمام المسلمين وقد تعلقوا في جبال شامخة صعبة الصعود فلم يبق أحد إلا وترجل عن فرسه قال: ومشينا حتى تقطعت نعالنا وسال الدم من أرجلنا فلم نزل على ذلك ثلاثة أيام والادلاء يقولون لنا كونوا على يقظة فإن أخذ عليكم المجاز هلكتم.,"The guides continued ahead of the Muslims and now reached high mountains which were difficult to climb. Everyone had to dismount and go on foot. We walked until our sandals fell apart and our feet bled. We remained in that state for three days while the guides said, “Be alert. If the crossing overpowers you you will be destroyed.”"
1170,فلما كان في اليوم الرابع خرجنا إلى أرض واسعة وكان دخولنا إلى بلاد الروم في أول الصيف ونحن مخففون من الثياب ولما دخلنا إلى تلك الأرض وجدنا بردا كثيرا ونظرنا إلى الثلج وهو على الجبال عن يميننا وشمالنا قال: وكان دامس أبو الهول يأخذ معه ثيابا تدفئه فحصل له من البرد فقال: يا أبا الهول ما لي اراك ترتعد.,"On the fourth day we finally reached an open space. We had entered the Roman territory in the beginning of summer and were therefore lightly dressed. The new land was bitterly cold and the mountains to the left and right were covered in snow. Damis had no warm clothing and was being affected by the cold. I asked him, “O Abu al-Hawl, why are you shivering?”"
1171,فقال أخذني البرد وليس معي ما يدفئني.,"“I am getting cold,” he replied, “and do not have anything with me to keep me »"
1172,فدفع إليه فروة فلبسها فدفىء فقال كساك الله من ثياب الجنة.,"I gave him a piece of fur which he wore. Once he warmed up he said, “May Allah dress you in the garments of Jannah.”"
1173,قال الواقدي: وساروا إلى أن وصلوا إلى أرض طيبة كثيرة المياه قليلة الشجر فنزلوا فيها ثم إنهم ساروا فلم يروا احدا لأن الروم كانوا قد نزحوا عن البلاد لحذرهم من المسلمين فلما كان في اليوم الخامس ونحن سائرون إذ لاحت لنا قرية فقصدها المسلمون وإذا هي خالية بل سمعوا أصوات الديوك والغنم فدخلوها فلم يجدوا عندها مانعا ولا دافعا فعرفنا انهم تواروا عنا فصاح ميسرة وقال خذوا حذركم فإن القوم قد انهزموا.,"We continued until we reached a pleasant land with abundant water and few trees. We did not see anyone there because the Romans had emigrated out of fear of the Muslims. When we saw a village on the fifth day we went towards it. We saw that it was uninhabited but could hear chickens and sheep. We entered the village without finding any defender or obstruction and realised that the people must have run away from us. Maysarah shouted, “They must have fled from us.”"
1174,فدخل الناس إلى القرية فأخذوا ما كان فيها من طعام وأثاث ومتاع.,"The Muslims entered the village and took whatever food, furniture and goods that were there."
1175,قال سعيد بن عامر فرأيت أبا الهول وهو يحمل على عاتقه ثلاثة اكسية وقطعتين قال فقلت له يا أبا الهول ما هذا.,Sa’id bin ‘Amir narrates:
1176,فقال استعد به لبرد هذه البلاد الخبيثة فما أنساها أبدا.,"“I am preparing for the cold of this disgusting land which I will never forget,” he replied."
1177,قال: وأخذوا ما كان في القرية من طعام وعلوفة وساروا إلى أن وصلوا إلى مرج ي قال له: مرج القبائل وهو مرج واسع فانبثت الخيل فيه يمينا وشمالا ونزل الجيش هناك وميسرة يراود نفسه في الرجوع إلى حلب وذلك أن أبا عبيدة كان قد أمره أن لا يبطىء عنه وإن يكون حذرا.,"The Muslims took all the food and fodder of the village and continued the journey until they reached a meadow called Meadow of the Tribes. It was spacious and we let the horses loose to gallop. The army camped there, but Maysarah began thinking of returning to Aleppo because Abu ‘Ubaydah had ordered him not to tarry and to remain on guard."
1178,فبينما هو كذلك والخيل منبثة والناس آمنون من عدو يدهمهه إذ أقبل بعض الخيالة ومعه علج يقوده.,Whilst the Muslims were in this state a horseman appeared with a prisoner.
1179,فلما وصل إلى ميسرة قال له: ما شأن هذا ومن أين أخذته فقال اعلم أيها الأمير إني سبقت اصحابي فرايت شخصا يلوح مرة ويختفي مرة فأسرعت إليه فإذا هو هذا فأتيته وسقته اليك.,Maysarah: Where did you get him from?
1180,قال فتقدم إليه رجل من المعاهدين فسأله فحدثه فاطال معه الكلام والناس سكوت فلما أطال قال ميسرة ويلك ما الذي يقول هذا العلج.,"An allied Christian went to question the prisoner. They spoke to him for a long time while the Muslims remained quiet. When the conversation dragged on longer Maysarah snapped, “Woe unto you! What is he saying?”"
1181,فقال: أيها الأمير انه يقول أن الملك هرقل لما ركب البحر وخرج من انطاكية ووصل إلى قسطنطينية قصدته الروح من كل مكان من المنهزمين وغيرهم وبلغه أن انطاكية قد فتحت صلحا وإنه قتل من كان فيها من المقاتلة فصعب عليه وبكى ثم قال السلام عليك يا أرض سوريا إلى يوم اللقاء.,"Ally: O commander, he says that when Heraclius fled from Antioch via the sea and reached Constantinople, the Roman refugees and others went to him. When he heard that Antioch had peacefully been conquered and that his warriors had been killed he took it very badly and wept saying, “O land of Syria, peace be upon you until the day of meeting.”"
1182,وقد تجمع عنده من البطارقة والحجاب وغيرهم خلق كثير فقال لهم: إني أخاف من العرب أن ترسل في طلبنا.,"He then said to the patricians and chamberlains who had gathered around him, “I fear that the ‘Arabs will come after me.”"
1183,ثم إنه جهز ثلاثين ألفا مع ثلاثة بطارقة وأمرهم أن يحفظوا له الدروب فقال له ميسرة: قل له كم بيننا وبينهم.,"He then sent 30,000 troops under three patricians to defend the passes for him. Maysarah: Ask him what the distance is now between us and them."
