,Arabic,English
390,فعند ذلك أقبل البطريق على أصحابه وقال ارموا الأحمال عن هذه الدواب واعقروها وسوقوا بقية الدواب بما عليها فإنها لنا ميرة واطلبوا الجبل واختفوا عن أعين العرب وإلا ففي هذه الساعة تطلع علينا خيول العرب كالرياح تهزمكم فأكمنوا حتى إذا جاء الليل طلبنا القلعة واعتصمنا بها,"The enemy commander said, “Take the load off some of the animals and cut their legs. Bring the rest with their loads because it will be provision for us. Head for the mountains and hide from the spies of the ‘Arabs or else they will be here this very moment with horses coming like a wind to defeat you. So hide until nightfall when we can return to the protection of the fort.”"
391,ففعلوا ذلك وقتلوا الجمال وساقوا الدواب والتجؤا في الجبل إلى قرية فأقاموا بقية يومهم يرقبون الليل ليرجعوا إلى القلعة وأقاموا لهم ديدبانا,"They killed the camels and took the mules. They hid in a village in the mountain for the rest of the day, waiting for the cover of night to return to the fort. A watchman was appointed."
392,قال عوف صباح الطائي كنت في الخيل لما قتل عمي مناوش ونحن في قلة وقد دهمتنا الخيل فلما نظرنا إلى كثرة الروم وشدة بأسهم مع قلتنا أخذنا على أنفسنا وأتينا المسلمين فبادر إلينا أبو عبيدة وقال لنا ما وراءكم قلنا الحرب والطعان قتل منا مناوش وقتل معه خلق كثير من فرساننا وأخذ ما كان معنا من الزاد والدواب.,’Awf bin Sabbah at-Tal narrates:
393,فقال أبو عبيدة: وما الذي دهاكم وقد حاصر الله الروم ما يجسر أحد أن يخرج منهم,Abu ‘Ubaydah: What could have befallen you when Allah has encircled the Romans and none can come out?
394,قالوا: لا علم لنا غير أنا رأينا بطريقا عظيما قد أشرف علينا وهو في عدة حصنة وخيول كثيرة مستعدين للقتال لا نعلم عددهم ولا من اين أتى مددهم فهجموا علينا ونحن سائرون فاصيب أميرنا وقتل رجالنا وأخذوا ما كان معنا من الدواب والزاد,"Muslims: We do not know except that we saw a great patrician come against us in good gear and with many horsemen prepared for battle. We do not know their numbers, nor where they came from. They attacked us during our journey. They killed our commander and others and took our beasts and provisions."
395,فلما سمع أبو عبيدة ذلك دعا بخالد بن الوليد إليه وقال: يا أبا سليمان أنت لها والمعد لمثلها وأنا واثق بالله ثم بك مع إني أستخير الله في أموري,"Abu ‘Ubaydah called Khalid and said, “O Abu Sulayman, you are the man for this job. I place my reliance first upon Allah, then upon you and I seek goodness from Allah in all my affairs."
396,سر على بركة الله تعالى وخذ معك من المسلمين من أردت لعلك أن تقفوا القوم وتعاني موضع أثر الوقعة وتتبع آثارهم عسى الله أن يوقعنا بهم واطلبهم أينما كانوا وحيث ساروا لعلك تأخذ بثأر المسلمين وأعلم اننا صالحنا أهل الوادي واننا لا ننقض عهدنا ولا نحول عن قولنا إلا أن يكون القوم قد مكروا بنا فنجد إلى قتالهم سبيلا فاتق الله فيهم سر يرحمك الله,"Go with Allah’s blessings and take whoever you like from the Muslims. Go where the incident took place and follow their trail, perhaps Allah will let us catch them. Seek them out wherever they may be and avenge the Muslims. Remember that the people of the valley have a treaty with us so we should not be the ones to break our word. However, if they have betrayed us then we will fight them, so fear Allah with regards to their rights. Now go. May Allah have mercy on you.”"
397,قال فأسرع خالد إلى خيمته ولبس سلاحه واستوى على متن جواده وهم بالمسير وحده فقال له أبو عبيدة: إلى أين يا أبا سليمان,"Khalid rushed to his tent and took his arms. He then mounted his horse, intending to leave alone. Abu ‘Ubaydah called out,“Where are you going to, Abu Sulayman?”"
398,قال له: اسارع إلى ما أمرتني به فقال له: خذ من أردت معك من المسلمين فقال خالد: أنا أمضي وحدي وما أريد أحدا,Khalid: To where you have ordered me to go.
399,فقال له أبو عبيدة: كيف تمضي وحدك وعدوك في عدد كثير قال خالد: لو كانوا في ألف أو ألفين القاهم بمعونة,Abu ‘Ubaydah: How can you go alone when your enemies are so many?
400,سقطمن النسخة,Khalid’s revenge
401,قال فاخذ ضرارا وأمثاله وسار حتى أتى إلى موضع الوقعة فراى القتلى مطروحين ورأى حولهم أهل الوادي وهم يبكون خوفا من المسلمين على أنفسهم وذراريهم وأن العرب تطالبهم بهم فلما طلع عليهم خالد ومن معه كأنهم شعلة نار تصارخ القوم في وجهه والقوا أنفسهم بين يديه,Khalid eventually agreed to take Dirarand others like him. When they reached the battle site they saw the dead Muslims lying all around. They were surrounded by the people of the valley who were weeping out of fear that the Arabs would take them to account for the incident and take vengeance upon them and their children. So when the Muslims arrived they screamed and threw themselves in front of Khalid.
402,فقال لهم خالد: من هؤلاء القوم الذين قتلوا أصحابنا قالوا: أنا نحن بريئون من دماء أصحابكم ونحن في صلحكم فاستحلفهم خالد إنهم لا يعلمون من قتلهم فحلفوا له,Khalid: Who killed our men?
403,فقال لهم: من الذي أوقع بأصحابي فقالوا: بطريق بعثه يوقنا من القلعة ومعه ألف فارس من أشد قومه وأن لهم في عسكركم عيونا يخبرونه بما أنتم فيه كل ساعة فقال لهم: وفي أي طريق قصدوا قالوا: في هذا الطريق,Khalid:Then who could have attacked them?
404,فقال خالد: أو ما حلفتم أن ما عندكم علم بهم,Khalid: Did you not swear to me that you had no knowledge of them?
405,قالوا: هذا الذي يخبرك من أهل حلب قد أتى يشتري طعاما ولولا إنك أقبلت في هذه الساعة ما كنا عرفنا من قتلهم فقال له خالد: أعلى هذا الطريق أخذوا فقال له الرجل: نعم ورأيتهم يطلبون الجبل,Christian: He who informs you is not of us. He is an Aleppan who had come to buy food. We had no information to give you.
406,فقال خالد لأصحابه: أن القوم علموا إنهم لا بد لهم من خيل تطلبهم وتتبعهم وقد عدلوا عن طريقنا حتى إذا هجم عليهم الليل رجعوا إلى قلعتهم فعولوا على المسير في طلبهم,"Khalid then said to his men, “They realised that we would come after them so they must have gone from the road to hide until night-time and then return to their fort. Let us go after them.”"
407,ثم إنهم ارخوا الأعنة وخالد يقدمهم,سقطمنالنسخة
408,وقد أخذ معه رجالا من المعاهدين يقفون بهم أثر الطريق والقوم فلما حصلوا على الطريق قال خالد لواحد من المعاهدين: ألهم طريق إلى قلعتهم غير هذا؟.,"Taking some Christian guides with them, the Muslims continued the pursuit. When they reached the road, Khalid asked one of the Christians, “Is there any other road which they can take back to the fort?”"
409,قال: نعم ولكن كن ههنا فانك تفوز بهم أن شاء الله تعالى,"“Yes,” replied the Christian, “but they will still have to pass by here. If you stay here you will be successful, God-willing.”"
410,فنزل خالد ومن معه في الوادي وهم يرقبون الطريق,"So they dismounted in the valley and hid, watching the road."
411,فما مضى من الليل إلا قليل إذ سمع وقع حوافر الخيل والبطريق أمامهم والخيل من ورائه وهو يزجرهم ويحثهم على المسير فلما توسطوهم صاح خالد صيحة شديدة ووثب خالد كأنه الاسد وخرج عليهم هو وأصحابه,"Not much of the night had passed when the sound of pounding hooves was heard. The patrician was at the head of his men, encouraging them. When half of them had passed by, Khalid shouted like a lion and led his men out against them."
412,فما كان قصد خالد غير البطريق وظن إنه يوقنا فضربه ضربة رماه نصفين وقد وضعوا السيف فيهم وجعلوا يطلبونهم وهم في الهرب فلم ينج منهم إلا من أطال الله أجله,"He thought that the patrician might be Yuqanna himself, so he aimed for him and cut him into two pieces with a single blow. The Muslims hacked them down with their swords until none survived except those for whom Allah had willed that their life-spans should be extended."
413,وحازوا جميع ما معهم وأتوا برأس البطريق إلى أبي عبيدة على رأس رمح فوجدوه متلهفا على قدومهم فلما أشرف خالد بمن معه من الاسارى والإسلاب والدواب هللوا وكبروا فأجابهم العسكر بالتهليل والتكبير,"The Muslims gathered all the booty, spiked the patrician’s head on a spear point and took it to Abu ‘Ubaydah, whom they found to be eagerly awaiting them. As Khalid arrived with all the booty, prisoners and mules his men called out, “La ilaha Illallah! Allahu Akbar!” to which the Muslims in the camp responded in a like manner."
414,قال: وأتى خالد ومن معه بالرأس والإسلاب والاسارى فكانوا أزيد من ثلثمائة اسير ورؤوس القتلى سبعمائة فعرضوا عليهم الإسلام فابوا وقالوا: نحن نعطيك الفداء,"There were 700 decapitated heads while more than 300 prisoners were taken. They were offered Islam, but refused and said, “We will pay ransom.”"
415,فقال خالد: نضرب رقابهم قبال القلعة لنوهن بذلك عدو الله قال فضربت رقابهم قبال القلعة فقال خالد: أنا كنا نظن أنا محاصرون القوم وإذا نحن بخلاف ذلك وهم يرقبون غفلتنا وينتظرون غرتنا وقد قتلوا جمالنا والدواب والصواب أن نجعل عليهم حرسا في كل طريق يمكننا ولا نمكنهم أن يخرجوا من قلعتهم ونضيق عليهم ما استطعنا,"“We will strike your necks to terrorise Allah’s enemy,” retorted Khalid who proved true to his word. He then said, “We thought that we had them tightly besieged, but that is not so. They merely wait until we are neglectful and then they come raiding. They killed our camels and mules, so it is only proper that we post tight security on every road so that we may pass through while they are trapped in the fort. We should make life as difficult as possible for them.”"
416,قال أبو عبيدة: جزاك الله خيرا يا أبا سليمان ما ابصرك بالأمور,"Abu ‘Ubaydah: May Allah reward you well, Abu Sulayman. What excellent insight you have."
417,فلما كان من الغد وصلىأبو عبيدة بالناس صلاة الفجر دعا بعبد الرحمن بن أبي بكر وبضرار بن الأزور وسعيد بن زيد بن عمرو بن نفيل وقيس بن هبيرة وميسرة بن مسروق,"After leading the Mulsims the next day in Salatul Fajr, Abu ‘Ubaydah called ‘Abdurahman bin Abi Bakr, Dirar, Sa’id bin Zayd bin ‘Amr bin Nufayl, Qays bin Hubayrah and Maysarah bin Masruq."
418,ففرقهم حول القلعة ومعهم من اختاروا وأمرهم أن يمسكوا الطريق والمسالك على يوقنا حتى لو طار طائر منها أو إليها اقتنصوه,He ordered each one to guard a separate spot with men of his own choice and to cut off all roads to Yuqanna to the extent that if even a bird flew over they should cage it.
419,وأقام القوم على ذلك مدة فلما طال عليهم ذلك ضجر أبو عبيدة لطول مقامه فأمر الناس بالرحيل عنهم وعزم أن يتباعد عنهم أي عن القلعة لعل أن يجد منهم غفلة فينتهزها قال فبعد عن المدينة,"They did this, but as time passed slowly, Abu ‘Ubaydah became exasperated. He ordered the Muslims to withdraw so that they could return and attack once the enemy had lowered its guard."
420,سقطمن النسخة,The spy
421,فنزل بقرية بقرب منها يقال لها النيرب وهو يريد حيلة يصل بها إلى يوقنا قال: ويوقنا لا ينزل من القلعة ولا يفتح بابها ففكر أبو عبيدة غاية الفكرة وقال لخالد يا أبا سليمان أن جواسيس عدو الله تكشف أخبارنا وتوصلها إليه وتخوفه فاني أقسم عليك يا أبا سليمان إلا ما جلت في عسكرنا جولة واختبرت أمر الناس فلعلك تقع بأحد من جواسيسه,"The Muslims withdrew to a nearby village, an-Nirab, but Yuqanna showed no sign of opening the gate and coming out. Abu ‘Ubaydah became extremely worried and said to Khalid, “O Abu Sulayman, the spies of Allah’s enemy go and warn him. Go around the camp and investigate. Perhaps you will discover a spy.”"
422,قال فركب خالد وأمر الناس أن يدوروا في عسكرهم وأن يقبضوا على كل من إنكروه قال فبينما خالد في طوافه إذ نظر إلى رجل من العرب المتنصرة وبين يديه عباءة يقلبها فجعل خالد يرقبه فاستراب الرجل منه,KMlid mounted his horse and ordered that any stranger should be caught. As he patrolled he came across a Christian ‘Arab who carried a cloak and kissed it. When he saw Khalid his blood curdled
423,فناداه وقال من أي الناس أنت يا أخا العرب قال أنا رجل من اليمن قال من أيها قال فأراد أن يقول: وينتمي إلى غير قبيلته فجرى الحق على لسانه فقال أنا من غسان,Khalid: From which nation are you?
424,فلما سمع خالد كلامه قبض عليه وقال له: يا عدو الله أنت عين علينا لعدونا قال: ما أنا متنصر وأنا مسلم فأتى به إلى أبي عبيدة وقال: أيها الأمير قد رابني أمر هذا لأنني ما رأيته قط إلا يومي هذا وقد ذكر إنه من غسان ولا شك إنه من عباد الصليب فقال أبو عبيدة: اختبره يا أبا سليمان,"Khalid: O enemy of Allah, you are the spy for our enemy!"
425,قال: وكيف أختبره قال اختبره بالقرآن والصلاة فإن أجابك وإلا فهو كافر فقال له خالد: فصل ركعتين واجهر بالقراءة فيهما فلم يدر ما يقول: فقال له خالد: أنت يا عدو الله عين علينا,Khalid: With what?
426,ثم استخبره عن شأنه فأخبره وأقر إنه عين عليهم فقال له خالد: أنت وحدك قال: لا ولكنا ثلاثة أنا أحدهم والاثنان قد ذهبا إلى القلعة ليخبرا يوقنا بخبركم وأنا قد تخلفت لأنظر ما يكون من أمركم.,Upon further questioning he confessed that he was a spy.
427,فقال أبو عبيدة: أخبرني أيما أحب إليك القتل أو الإسلام فليس بعدهما شيء فقال الغساني أنا أشهد أن لا إله إلا الله وأشهد أن محمدا رسول الله,"Abu ‘Ubaydah: What do you prefer, Islam or death? You have no other option."
428,سقطمن النسخة,‘Umar’s complaint
429,ثم رجع أبو عبيدة إلى حلب وما زالت القلعة محاصرة أربعة أشهر وقيل خمسة اشهر وابطأ خبر أبي عبيدة على أمير المؤمنين عمر بن الخطاب رضي الله عنه فكتب إلى ابي عبيدة يقول:,Abu ‘Ubaydah returned to Aleppo where the fort remained under siege for another four to five months. ‘Umar had not received any information from him for a lengthy period of time so he wrote to him:
430,بسم الله الرحمن الرحيم من عبد الله عمر إلى عامله أبي عبيدة سلام عليك فاني أحمد الله الذي لا إله إلا هو واصلي على نبيه محمد صلى الله عليه وسلم,"In the name of Allah, the Most Gracious, the Most Merciful."
431,واعلم يا أبا عبيدة أن بانقطاع كتابك وابطاء خبرك يكثر قلقي ويضني جسدي على إخواني المسلمين وما لي ليل ولا نهار إلا وقلبي عندكم ومعكم فإذا لم يأت منك خبر ولا رسول فإن عقلي طائر وفكري حائر وكأنك لا تكتب الي إلا بالفتح أو الغنيمة,"O Abu ‘Ubaydah! Know that because of you not sending any information my heart and my very body is undergoing difficulty, worrying about the Muslims. Day and night my heart is with you. When I neither receive any information nor any messenger from you, my mind wanders and my thoughts are confused. You write of neither conquest nor booty."
432,واعلم يا أبا عبيدة أنني وأن غائبا عنكم فإن همتي عندكم وإني داعي لكم وقلقي عليكم كقلق الوالدة الشفوقة على ولدها فإذا قرأت كتابي هذا فكن للاسلام والمسلمين عضدا والسلام عليكم ورحمة الله وبركاته,"O Abu ‘Ubaydah! Know that I may be physically absent from you, but my thoughts are constantly with you and I continuously make du ’a for you. My anxiety for you is like an affectionate mother s towards her baby. Please act as a helper of Islam and the Muslims when you receive my letter."
433,وبعث الكتاب إلى أبي عبيدة,He then sent the letter.
434,فلما ورد عليه وقرأه عليهم قال معاشر المسلمين إذا كان أمير المؤمنين داعيا لكم وراضيا عنكم في فعالكم فإن الله ينصركم على عدوكم ثم كتب جواب الكتاب يقول:,"Abu ‘Ubaydah read out the letter to the Muslims and said, “0 Muslims, when the Commander of the Believers is making du’a for you and is pleased with you then Allah will help you.” He then wrote the following reply:"
435,بسم الله الرحمن الرحيم إلى ابي عبد الله أمير المؤمنين عمر بن الخطاب من عامله بالشام أبي عبيدة سلام عليك وإني أحمد الله تعالى وأصلي على نبيه وبعد,"In the name of Allah, the Most Gracious, the Most Merciful."
436,يا أمير المؤمنين فإن الله تعالى له الحمد قد فتح على أيدينا قنسرين وقد شننا الغارة على العواصم وقد فتح الله علينا مدينة حلب صلحا وقد عصت علينا قلعتها وبها خلق كثير مع بطريقها يوقنا وقد كادنا مرارا,"O Commander of the Believers! Allah Most High to Whom all praise belongs conquered Qinsarin at our hands after which we raided al-’Awasim. Allah then granted us Aleppo by treaty. However, the fort which holds many men under the prince, Yuqanna, still defies us. He has tricked us several times."
437,وذكر له ما جرى له مع أخيه يوحنا,(He then mentioned the whole incident of Yuhanna.)
438,وأنه قتل منا رجالا ورزقهم الله الشهادة على يديه ثم إنه ذكر له من قتل والله تعالى من ورائه بالمرصاد وقد أردنا الحيلة عليه فلم نقدر وأردت الرحيل عنه وعن محاصرته إلى البلاد التي بين حلب وانطاكية وأنا منتظر جوابك,He killed many of our men whom Allah blessed with martyrdom at his hands.
439,والسلام عليك وعلى جميع المسلمين,سقطمنالنسخة
440,وبعث الكتاب مع عبد الله بن قرط وجعدة بن جبير,He sent the letter with ‘Abdullah bin Qurt and Ja’dah bin Jubayr
441,فسار إلى أن أخذا في طريق هيشت العتيقة وجدا في السير حتى قطعا أرض الجفار إلى صكاصكة وهي حصن العرب قريبة من تيما فلما وصلا إليها عارضهما فارس وعليه درع سابغ وعلى رأسه بيضة تلمع وهو معتقل برمح كأنه قد برز إلى عدوه أو قاصد إلى قتال فلما نظر إليهما قصدهما,The two took the al-’Atiqah road and travelled hard until they had crossed the land of al-Jaffar to Sakasikah which is an ‘Arab fort close to Tima. A horseman was spotted who was wearing full armour and a glittering helmet. He held his spear as if he had either just come from combat or was about to engage in combat. When he saw them he came towards them.
442,فقال عبد الله بن قرط لجعدة ابن جبير يا ويلك أما ترى هذا الفارس وقد عارضنا في مثل هذا المكان على مثل هذه الحالة,Ibn Qurt: Do you see this horseman coming towards us in this place and condition?
443,فقال له جعدة: وما عسى أن نتخوف من فرسان العرب ورجالها وليس في هذا الموضع من رفع عمودا أو ضرب وتدا إلا واصبح معنا ودخل تحت طاعتنا وفي شريعتنا,Ja’dah: Why should we fear any ‘Arab horseman when there is nobody in this region who lifts a spear or ties a bow except that he has entered under our rule and law?
444,فلما قرب الفارس منا سلم علينا وقال من أين أقبلتما والى اين قاصدان,"The horseman appeared, made salam, and asked, “Where are you two coming from and where are you going to?”"
445,فقالا له نحن رسولان من الأمير أبي عبيدة إلى أمير المؤمنين عمر بن الخطاب رضي الله عنه فمن أنت أيها الرجل,"“We are messengers from the general, Abu ‘Ubaydah, to the Commander of the Believers, ‘Umar bin al-Khattab – may Allah be pleased with him,” they replied, “and who are you?”"
446,قال أنا هلال بن بدر الطائي,Horseman: I am Hilal bin Badr at-Tai.
447,فقالا له ما لنا نرى عليك آلة الحرب,Messengers: Why do we see you carrying weapons?
448,قال إني خرجت في طوائف من قومي وجماعة من أصحابي نريد الشام للجهاد لكتاب ورد علينا من عمر بن الخطاب فلما رأيتكما في بطن الوادي قصدتكما لأنظر ما قصتكما ولي أصحاب من ورائي مقبلون.,Hilal: I have come with some of my people to wage Jihad in Syria due to a letter we had received from ‘Umar When I saw the two of you at the bottom of the valley I headed towards you. My people are coming behind me.
449,ثم سلم عليهما وولى فركضا مطيهما وسارا وإذا بالخيل قد أشرفت والإبل قد اقبلت تتبع هلال بن بدر ارسالا يتبع بعضها بعضا إلى أن لحقوه فأخبرهم بقصة صاحبي رسول الله صلى الله عليه وسلم ففرحوا بذلك وساروا يريدون الشام,Hilal then made salam to them and departed. He saw his people’s caravan of camels coming in a line until they met up with him. When he told them about the two Sahabah they were pleased and continued towards Syria.
450,وأما عبد الله بن قرط وجعدة بن جبير فانهما وصلا المدينة ودخلا المسجد وسلما على عمر بن الخطاب وعلى المسلمين ودفعا له الكتاب فلما قرأه استبشر ورفع كفيه إلى السماء وقال اللهم اكف الناس شر كل ذي شر,"Ibn Qurt and Ja’dah reached al-Madinah. They entered the Masjid, made salam to ‘Umar and the Muslims and gave him the letter. Upon reading it he rejoiced and lifting his palms to the sky, saying, “O Allah, save the people from the evil of every evil one.”"
