,Arabic,English
266,فأنا أدركت سعيدًا هذا وقد قَتله البربر يوم دخولهم قرطبة عَنوةً وانتهابهم إياها، وحكم المذكور أخوه هو رأس المعتزلة بالأندلس وكبيرهم وأستاذهم ومتكلمهم وناسكهم، وهو مع ذلك شاعر طيب وفقيه، وكان أخوه عبد الملك بن مُنذر متهمًا بهذا المذهب أيضًا، وَلِيَ خُطبة الرد أيام الحكم — رضي الله عنه — وهو الذي صَلبه المنصور بن أبي عامر إذ اتهمه هو وجماعة من الفقهاء والقضاة بقرطبة أنهم يُبايعون سرًّا لعبد الرحمن بن عبيد الله ابن أمير المؤمنين الناصر — رضي الله عنهم — فقُتل عبد الرحمن، وصُلب عبد الملك بن منذر، وبُدِّد شمل جميع من اتُّهم.,"I myself met this same Sa’id; he was slain by the Berbers, on the day when they stormed and sacked Cordova. His brother Hakam was the head of the Mu’tazilites of Andalusia, their leader, professor and chief schoolman, as well as the most famous among them for his piety; at the same time he was a poet, a physician and a lawyer. His brother `Abd al-Malik Ibn Mundhir was also suspected of belonging to the same sect; in the days of al-Hakam (God be well pleased with him!) he was in charge of the Office for the Defence of the Oppressed, but was crucified by al-Mansur Ibn Abi ‘Amir on the charge, preferred against him, and a whole group of Cordovan lawyers and judges, of secretly swearing allegiance to `Abd al-Rahman Ibn `Ubaid Allah, grandson of Caliph al-Nasir (God be well pleased with them!) as lawful Caliph. `Abd al-Rahman himself was executed, `Abd al-Malik Ibn Mundhir was crucified, and the entire faction accused of the conspiracy were liquidated."
267,وكان أبوهم قاضي القضاة منذر بن سعيد متهمًا بمذهب الاعتزال أيضًا، وكان أخطب الناس وأعلمهم بكل فن، وأورعهم، وأكثرهم هزلًا ودُعابةً.,"The father of these three brothers, the Lord Chief Justice Mundhir Ibn Sa’id, came under the same suspicion of holding Mu’tazilite opinions; he was a most eloquent preacher, profoundly learned in every branch of knowledge, of the utmost piety, and withal the wittiest and most amusing of men."
268,وحَكَم المذكور في الحياة في حين كتابتي إليك بهذه الرسالة قد كُف بصره وأسنَّ جدًّا.,"The son Hakam aforementioned is still living at the time of writing this epistle; he is now very advanced in years, and quite blind."
269,خبر ومن عجيب طاعة المُحب لمحبوبه أني أعرف مَن كان سَهِر اللياليَ الكثيرة، ولقي الجهد الجاهِد، فقطعت قلبَه ضروبُ الوَجْد، ثم ظفر بِمن يُحب وليس به امتناع ولا عنده دفع، فحين رأى منه بعضَ الكراهة لما نَواه تركه وانصرف عنه، لا تعففًا ولا تخوُّفًا، لكن توقُّفًا عند مُوافقته رضاه، ولم يجد من نفسه مُعينًا على إتيان ما لم يَرَ له إليه نشاطًا وهو يَجد ما يجد.,"A wonderful example of how the lover will submit to the beloved is provided by a man I knew who lay awake for many nights, endured extreme suffering, and had his heart tom asunder by the deepest emotions, until he finally overcame his, beloved’s resistance, who thereafter refused him nothing and could no more resist his advances. Yet when the lover observed that the beloved felt a certain antipathy towards his intentions he forthwith discontinued relations, not out of chastity or fear but solely in order to accord with the beloved’s wishes. For all the intensity of his feelings, he could not bring himself to do anything for which he had seen the beloved had no enthusiasm."
270,وإني لأعرف من فعل هذا الفعل ثم تندَّم لعذر ظهر من المحبوب، فقلت في ذلك:  غَافِصِ الفُرْصَةَ وَاعْلَمْ أَنَّهَا *** كَمُضِيِّ البَرْقِ تَمْضِي الفُرَصُ كَمْ أُمُور أَمْكَنَتْ أُمْهِلُهَا *** هِيَ عِنْدِي إِذْ تَوَلَّتْ غُصَصُ بَادِرِ الكَنْزَ الَّذِي أَلْفَيْتَهُ *** وَانْتَهِزْ صَيْدًا كَبَازٍ يَقْنصُ,"I have put this situation into verse.  Seize the opportunity As it opens up to thee; Opportunities depart Swiftly as the lightnings dart.  Ah, the many things that I Might; have done, but let slip by, And the intervening years Brought me naught but bitter tears.  Whatsoever treasure thou Findest, pounce upon it now Wait no instant: swoop to day Like a falcon on thy prey."
271,ولقد عرض مثلُ هذا بعينه لأبي المظفَّر عبد الرحمن بن أحمد بن محمود صديقنا، وأنشدته أبياتًا لي؛ فطار بها كل مطار، وأخذها مني فكانت هجِّيراه.,"This very same thing happened to Abu ‘l-Muzaffar `Abd al-Rahman Ibn Ahmad Ibn Mahmud, our good friend: I quoted to him some verses of mine which he leapt upon with the greatest joy and carried off with him, to be his guiding star ever after."
272,خبر ولقد سألني يومًا أبو عبد الله محمد بن كُليب، من أهل القيروان، أيام كوني بالمدينة، وكان طويل اللسان جدًّا، مثقفًا للسؤال في كل فن، فقال لي وقد جرى بعض ذكر الحب ومعانيه: إذا كره مَن أحب لقائي وتجنَّب قُربي، فما أصنع؟,"When I was living in the old city at Cordova I one day met Abu `Abd Allah Muhammad Ibn Kulaib of Kairouan, a man with an exceedingly long tongue, well sharpened to enquire on every manner of subject. The topic of Love and its various aspects was under discussion, and he put the following question to me “If a person with whom I am in love is averse to meeting me, and avoids me whenever I try to make an approach, what should I do?”"
273,قلت: أرى أن تسعى في إدخال الرَّوْح على نفسك بلقائه وإن كره.,"I replied, “My opinion is that you should endeavor to bring relief to your own soul by meeting the beloved, even if the beloved is averse to meeting you.”"
274,فقال: لكني لا أرى ذلك، بل أوثر هواه على هواي، ومُراده على مرادي، وأصبر ولو كان في ذلك الحَتف.,"He retorted, “I do not agree; I prefer that the beloved should have his will and desire, rather than I mine. I would endure and endure, even if it meant death for me.”"
275,فقلت له: إني إنما أحببتُه لنفسي ولالتذاذها بصورته، فأنا أتبع قياسي وأقود أَصلي وأقفو طريقتي في الرغبة في سرورها.,"“I would only have fallen in love”, I countered, “for my personal satisfaction and aesthetic pleasure. I should therefore follow my own analogy, guide myself by my personal principles, and pursue my habitual path, seeking quite deliberately my own enjoyment.”"
276,فقال لي: هذا ظلم من القياس، أشد من الموت ما تمني له الموت، وأعز من النفس ما بذلت له النفس.,"“That is a cruel logic”, he exclaimed. “Far worse than death is that for the sake of which you desire death, and far dearer than life is that for the sake of which you would gladly lay down your life.”"
277,فقلت له: إن بذلت نفسك لم يكن اختيارًا، بل كان اضطرارًا، ولو أمكنك ألَّا تبذلها لما بذلتها، وتركُك لقاءه اختيارًا منك أنت فيه ملوم لإضرارك بنفسك، وإدخالك الحتف عليها.,"“But”, I said, “you would be laying down your life not by choice but under compulsion. If it were possible for you not to lay down your life, you would not have done so. To give up meeting the beloved voluntarily would certainly be most reprehensible, since you would thereby do violence to yourself and bring your own soul to its doom.”"
278,فقال لي: أنت رجل جدليٌّ، ولا جدل في الحب يلتفت إليه.,"Thereupon he cried out, “You are a born dialectician, and dialectics have no particular relevance to Love."
279,فقلت له: إذًا كان صاحبه مئوفًا.,"“In that case”, I said, “the lover will certainly be unfortunate.”"
280,فقال: وأيُّ آفة أعظم من الحب؟!,"“And what misfortune is there”, he ended, “that is greater than Love?”"
281,باب المخالفة وربما اتبع المحب شهوتَه وركب رأسه فبلغ شِفاءه من محبوبه، وتعمَّد مسرته منه على كل الوجوه سخط أو رضي.,"OF OPPOSITION SOMETIMES the lover follows his own lust, and lets himself go completely. He is cured of his sickness at the hands of the beloved, and is resolved to have his pleasure of the other at all costs, whether the beloved be angry or consent."
282,ومَن ساعده على الوقت هذا وثبت جنانُه وأُتِيحت له الأقدار، استوفى لذته جميعها، وذهب غمُّه، وانقطع همُّه، ورأى أمله، وبلغ مرغوبه.,"If the lover is assisted in this by circumstance, if his heart remains steadfast and the fates favour him, he will drain the cup of his joy to the last drop; his sorrows will depart, his cares will be at an end: he will see the fulfillment of his hopes, and attain all his desire."
283,وقد رأيتُ مَن هذه صفتُه، وفي ذلك أقول أبياتًا، منها:  إِذَا أَنَا بَلَّغْتُ نَفْسِي المُنَى *** مِنْ رَشَأٍ مَا زَالَ لِي مُمْرِضا فَمَا أُبَالِي الكُرْهَ مِنْ طَاعَةٍ *** وَلَا أُبَالِي سَخَطًا مِنْ رِضا إِذَا وَجَدْتُ المَاءَ لَا بُدَّ أَنْ *** أُطْفِي بِهِ مُشْعَلَ جَمْرِ الغَضَا,"I have myself seen lovers who comported themselves after this fashion: the following verses of mine describe the situation.  When I have had my will And slaked my soul’s desire Of some sweet fawn, who still Consumed my heart with fire;  I reek not if she be Reluctant to consent, Nor care if she agree But all malevolent.  Where’er the water may Be found, I’ll seize the same And sprinkle with its spray My tamarisk aflame."
284,باب العاذل وللحب آفات، فأوَّلها العاذل. والعذَّال أقسام، فأصلهم صديقٌ قد أسقطتَ مئونةَ التحفظ بينك وبينه، فعَذْلُه أفضل من كثير المساعدات.,"OF THE REPROACHER LOVE has its various misfortunes: of these the firs is the Reproacher. Of reproachers there are divers kinds. The original sort is a friend, between whom and yourself the burden of cautiousness has been let drop: his reproach is better than many abettings."
285,وهي من الحظ والنهي، وفي ذلك زاجر للنفس عجيب، وتقوية لطيفة لها عرض، وعمل ودواء تشتد عليه الشهوة، ولا سيما إن كان رفيقًا في قوله، حسن التوصل إلى ما يورد من المعاني بلفظه، عالمًا بالأوقات التي يؤكِّد فيها النهي، وبالأحيان التي يزيد فيها الأمر، والساعات التي يكون فيها واقفًا بين هذين، على قدر ما يرى من تسهل العاشق وتوعُّره، وقَبوله وعصيانه.,"It consists of incitements and prohibitions; therein and thereby the soul is wonderfully stimulated and remarkably strengthened; its properties are at once purposeful and efficacious, and healing to those sore wounded by passionate desire. Especially is this the case if the friend is gentle in his speech, and skilled at matching his words to his intentions; if he is aware of the times when the negative should be emphasized, and the occasions on which it is better to concentrate on positive injunctions; and if he is apprised of the hours wherein both approaches ought to be combined; all according to the degree of tractability or obdurateness, response or rebellion which he observes in the lover."
286,ولقد رأيت مَن اشتدَّ وَجْده وعَظُم كلفه حتى كان العَذْل أحبَّ شيء إليه، ليُري العاذلَ عصيانَه ويستلذَّ مخالفته، ويحصِّل مقاومته للأئمة وغلبته إياه؛ كالملك الهازم لعدوه، والمجادل الماهر الغالب لخصمه، ويُسَر بما يقع منه في ذلك، وربما كان هو المستجلب لعذل العاذل بأشياء يوردها توجب ابتداء العذل.,"I have seen a lover so violent in his emotions, and so overwhelmingly infatuated, that he loved to be reproached more than anything in the world, in order that he might show his reproacher how stubbornly he could rebel against his scoldings. He took a positive delight in opposing him, in provoking him to resistance and doubled reproof, and then in triumphing over him; his joy was like that of a king who puts his enemies to flight, or a skilled debater who triumphs over his opponent. Sometimes this motive inspires a lover to provoke the reproacher to reprimand him; he will do things, which oblige the censor to begin his faultfinding."
287,وَأَعْقَبَهُ التَّسَلِّي بَعْدَ هَذَا *** وَصَارَ يَرَى الهَوَى عَارًا وَذَامَا وَصَيَّر دُونَ مَنْ أَهْوَى رَقِيبًا *** لِيُبْعِدَ عَنْهُ صَبًّا مُسْتَهَامَا فَأَيُّ بَلِيَّةٍ صُبت عَلَيْنَا *** وَأَيُّ مُصِيبَةٍ حَلَّتْ لِمَاما؟,"Then, after all his pains, Oblivion attains, Calls passion to its face A shame and a disgrace.  And now, o’er her whom I Adore he’s set to spy, His charge, to keep apart From her my lovesick heart.  Ah, what calamitous Afflictions light on us, And what misfortunes fell Have come with us to dwell!"
288,ثم عاذل زاجر لا يُفيق أبدًا من الملامة، وذلك خطب شديد وعبء ثقيل.,"The second type of reproacher is the thoroughgoing scolder, who never lets up reprimanding the lover. That is a tough business, and a heavy burden to bear."
289,وَوقع لي مثلُ هذا، وإن لم يكن من جنس الكتاب ولكنه يُشبهه، وذلك أن أبا السريِّ عمار بن زياد صديقَنا أكثرَ من عذلي على نحو نحوتُه، وأعان عليَّ بعض من لامني في ذلك الوجه أيضًا، وكنت أظن أنه سيكون معي، مُخطئًا كنتُ أو مصيبًا؛ لوَكيد صداقتي وصحيح أُخوَّتي به.,"I myself once had a like experience, very similar to what we are here discussing though not strictly in the same type of situation. Our mutual friend Abu ‘l-Sari ‘Ammar Ibn Ziyad reproached me frequently about a certain course I was pursuing, and seconded the efforts of others who had reprimanded me on the selfsame score; yet I had always thought that he would take my side whatever I did, whether I was acting rightly or wrongly, because of the firm friendship and true brotherhood uniting us."
290,وفي ذلك أقول أبياتًا، منها:  أَحَبُّ شَيْءٍ إِلَيَّ اللَّوْمُ وَالعَذل *** كَيْ أَسْمَعَ اسْمَ الَّذِي ذِكْرَاهُ لِي أَمَلُ كَأَنَّنِي شَارِبٌ بِالعذلِ صَافِيَةً *** وَبِاسْمِ مَوْلَايَ بَعْدَ الشُّرْبِ أَنْتَقِلُ,"I have some verses on this topic.  To hear myself reproached and blamed Of all things this I love most fair, For then perchance her name is named Whose mention bids me not despair.  I quaff reproach, as though a cup I drain with purest wine replete, And after, having drunk it up, Devour my mistress’ name for sweet."
291,باب المساعد من الإخوان ومن الأسباب المتمنَّاة في الحُب أن يهب الله عزَّ وجل للإنسان صديقًا مُخلصًا، لطيفَ القول، بسيطَ الطَّول، حسنَ المأخذ، دقيقَ المنفذ، متمكنَ البيان، مُرهف اللسان، جليل الحلم، واسع العلم، قليل المخالفة، عظيم المساعفة، شديد الاحتمال، صابرًا على الإدلال، جم الموافقة، جميل المخالفة، مستوي المطابقة، محمود الخلائق، مكفوف البوائق، محتوم المساعدة، كارهًا للمباعدة، نبيل المدخل، مصروف الغوائل، غامض المعاني، عارفًا بالأماني، طيب الأخلاق، سريَّ الأعراق، مكتوم السر، كثير البر، صحيح الأمانة، مأمون الخيانة، كريم النفس، نافذ الحس، صحيح الحدْس، مضمون العون، كامل الصون، مشهور الوفاء، ظاهر الغَناء، ثابت القريحة، مبذول النصيحة، مستيقن الوداد، سهل الانقياد، حسن الاعتقاد، صادق اللهجة، خفيف المهجة، عفيف الطباع، رحب الذراع، واسع الصدر، متخلقًا بالصبر، يألف الإمحاض، ولا يعرف الإعراض، يستريح إليه ببلابله، ويشاركه في خلوة فكره، ويفاوضه في مكتوماته.,"OF THE HELPFUL BROTHER ONE of the things devoutly to be desired in Love is that Almighty God shall bestow upon a man a sincere friend, one moreover who is agreeable in speech, of amply abundant means, adroit in laying hold of an affair and shrewd in coming through it, masterly in setting forth an argument, sharp of tongue, of splendid magnanimity, widely learned, little apt to contradict, mighty in succour, strong to endure, patient in the face of impudence, broadly complaisant, a grand confederate, evenly matched, of praiseworthy character, innocent of all injustice, determined to be of help, loathing estrangement, noble in all his undertakings, averse to secret wickedness, profound in his conceptions, understanding his friend’s desires, of virtuous habits, high-born, absolutely discreet, abounding in good works, truly trustworthy, incapable of treachery, of a generous spirit, of penetrating sensibility, accurate in intuition, wholly dependable, a perfect shield, renowned for his fidelity, of manifest constancy, steady in temper, ready with good counsel, sure in his affection, easy to lead on, having a lively faith, truthful in all that he utters, of a gay heart, strictly chaste, wide in prowess, endowed with fortitude, accustomed to sincerity, a stranger to revulsion, a haven of rest in times of trouble, ready to share the privacy of his friend’s poverty and to partake of all its most intimate secrets."
292,وإن فيه للمحب لأعظمَ الراحات، وأين هذا، فإن ظفرتْ به يداك فشُدَّهما عليه شد الضنين، وأمسك بهما إمساك البخيل، وصُنْه بطارفك وتالدك، فمعه يكمل الأنس، وتنجلي الأحزان، ويقصر الزمان، وتطيب الأحوال، ولن يفقد الإنسان من صاحب هذه الصفة عونًا جميلًا، ورأيًا حسنًا؛ ولذلك اتخذ الملوك الوزراء والدخلاء كي يخففوا عنهم بعضَ ما حملوه من شديد الأمورِ، وطُوِّقوه من باهض الأحمال، ولكي يستغنوا بآرائهم، ويستمدوا بكفايتهم، وإلا فليس في قوة الطبيعة أن تقاوم كل ما يَرِد عليها دون استعانة بما يشاكلها وهو من جنسها.,"In such a friend the lover may truly find his greatest repose. But where is such a man to be found? If you are able to lay your hands upon him, grapple him to you as a miser hugs his gold, and grasp him tightly as a niggard grips his silver. Guard him with all that you possess, sparing neither your inheritance nor your hard-earned wealth; for having him, your joy will be complete, your sorrows will be dispersed, the long hours will go by swiftly, and all your affairs will pass agreeably. With such a comrade no man will lack for goodly help and fair counsel. Therefore do kings take unto themselves ministers and courtiers that they may lighten for them somewhat of their heavy burden, and the crushing load they carry on their shoulders; that they may derive riches from their counsels, and reinforcement from their competency. Otherwise it is not within the power of human nature to withstand all the shocks that assail it, except a man seek succour of a kindred spirit, one resembling him in kind."
293,وفي ذلك أقول قطعةً، منها:  سَأبعدُ عَنْ دَوَاعِي الحُبِّ إِنِّي *** رَأَيْتُ الحَزْمَ مِنْ صِفَةِ الرَّشِيدِ رَأَيْتُ الحُبَّ أَوَّلُهُ التَّصَدِّي *** بَعَيْنِكَ فِي أَزَاهِيرِ الخُدُودِ فَبَيْنَا أَنْتَ مُغْتَبِطٌ مُخَلًّى *** إِذَا قَدْ صِرْتَ فِي حَلَقِ القُيُودِ كَمُغْتَرٍّ بِضَحْضَاحٍ قَرِيبٍ *** فَذَلَّ فَغَابَ فِي غمرِ المدودِ,"I have a poem on this subject, and will quote an extract.  I am resolved to keep afar Wherever Love’s attractions are; The man of sense, as I detect, Is ever shrewd and circumspect.  I have observed that love begins When some poor fellow for his sins, Thinks, it is thrilling, ever so, To gaze on cheeks where roses glow.  But while he sports so joyfully With not a care to mar his glee, The links are forging, one by one, And he’s enchained, before he’s done.  So there he is, deluded fool; Stepping benignly in the pool He slips, and ere he can look round He’s swept along the flood, and drowned."
294,ولقد كان بعض المحبين، لعدمه هذه الصفة من الإخوان، وقلَّة ثقته منهم لما جرَّبه من الناس، وأنه لم يعدم مَن باح إليه بشيء من سرِّه أحد وجهين؛ إما إزراءً على رأيه، وإما إذاعةً لسره، أقام الوحدة مقام الأنس، وكان ينفرد في المكان النازح عن الأنيس، ويناجي الهوى، ويكلم الأرض، ويجد في ذلك راحة كما يجد المريض في التأوُّه، والمحزون في الزفير؛ فإن الهموم إذا ترادفت في القلب ضاق بها، فإن لم يُنْضِ منها شيء باللِّسان، ولم يسترح إلى الشكوى، لم يلبث أن يهلك غمًّا ويموت أسفًا.,"Some lovers there are who, missing this quality in their friends, and having little confidence in them because of their experience of mankind-for the one to whom the lover’s secret is entrusted will generally act in one of two ways: either he will mock his opinion, or he will publish his secret therefore prefer solitude to society, and go apart from their fellows into desolate places, communing with the air and conversing with the earth; in which conduct they discover relief, as the sick man in his sighing, and the sorrowful man in his sobbing. For when cares crowd thickly into the; heart, the heart can no more contain them; and if it gives not vent to them with the tongue, and finds not relief in lamentation, the sufferer perishes of grief and dies of sorrow."
295,وما رأيت الإسعاد أكثر منه في النساء؛ فعندهن من المحافظة على هذا الشأن، والتواصي بكتمانه، والتواطؤ على طيِّه إذا اطَّلعن عليه ما ليس عند الرجال، وما رأيت امرأة كشفت سرَّ متحابين إلا وهي عند النساء ممقوتة مستثقلة مرمية عن قوس واحدة.,"I have never seen anything to equal the helpfulness of women in this respect. They are far more forward than men in keeping love’s secret, in counseling each other to be discreet, and in co-operating to conceal it whenever they happen to know of any such affair. I have never in my life known a woman to reveal the secret of a loving couple, without that she was hated, loathed and unanimously condemned by all her sisters."
296,وإنه ليوجد عند العجائز في هذا الشأن ما لا يوجد عند الفتيات؛ لأن الفتيات منهن ربما كشفن ما علمن على سبيل التغاير، وهذا لا يكون إلا في النُّدرة، وأما العجائز فقد يَئِسن من أنفسهن؛ فانصرف الإشفاق محضًا إلى غيرهن.,"Old women excel young girls in this particular the latter sometimes do disclose what they know out of jealousy (though that happens indeed rarely), whereas the former have despaired of further romances, and are therefore now anxious solely for the welfare of others."
