,Arabic,English
758,قال: فإن صاحبك هذا أبدى عنوان محبته وقذف بنفسه يريد الموت لولا أن الله عز وجل وقاه، فأنت قُم فصحِّح حبك وترامَ من أعلى هذه القصبة كما فعل صاحبك، فإن متَّ فبأجلك، وإن عشتَ كنت أولى بالجارية إذ هي في يدك، ويمضي صاحبك عنك، وإن أبَيْتَ نَزعتُ الجارية منك رغمًا ودفعتُها إليه.,"“Very well”, went on the king. “Your friend here has given us a clear indication of his love; he hurled himself down, and would have died, but that Almighty God preserved him. Now do you stand up and prove your love is true; cast yourself down from the topmost point of this pavilion, as your friend did. If you die, it will mean that your appointed time has come; if you live, you will have the better right to the girl, seeing that she is at present your property; and your companion in distress shall then go away. But if you refuse to jump, I will take the girl from you, whether you like it or not, and will hand her over-to him.”"
759,فتمنَّع ثم قال: أترامى.,"At first the Berber held back, but then he said, “I will cast myself down.”"
760,فلما قرب من الباب ونظر إلى الهويِّ تحته رجع القَهقَرى، فقال له الملك: هو والله ما قلت.,"But when he came near the opening, and looked into the yawning void below him, he drew himself back again. “By Allah”, cried the king, “it shall be as I have said.”"
761,فهمَّ ثم نَكل، فلما لم يقدم قال له الملك: لا تتلاعب بنا، يا غلمان، خذوا بيديه وارموا به إلى الأرض.,"The man tried again, but shrunk away once more. When he would not take the plunge, the king shouted to him, “Do not make sport of us! Ho, slaves, seize his hands and pitch him to the ground!”"
762,فلما رأى العزيمة قال: أيها الملك، قد طابت نفسي بالجارية.,"The Berber, seeing the king thus resolved, exclaimed, “O king, I am content: let him have the girl.”"
763,فقال له: جزاك الله خيرًا. فاشتراها منه ودفعها إلى بائعها، وانصرفا.,"The king replied, “Allah give thee a good recompense!” So saying, he bought the girl from him and gave her over to her former owner; and the two departed."
764,باب قبح المعصية قال المصنف — رحمه الله تعالى: وكثير من الناس يُطيعون أنفسهم ويعصون عقولهم، ويَتبعون أهواءهم، ويرفضون أديانهم، ويتجنَّبون ما حضَّ الله تعالى عليه ورتَّبه في الألباب السليمة من العِفَّة وترك المعاصي ومُقارعة الهوى، ويخالفون الله ربَّهم، ويوافقون إبليس فيما يُحبه من الشهوة المُعْطِبَة، فيواقعون المعصية في حبهم.,"OF THE VILENESS OF SINNING THUS spoke the author of this book, God have mercy upon him: Many men obey their carnal souls, and disobey their reasons; they follow after their random desires, rejecting the ordinances of religion, and scouting God’s commandments. For Allah has put it into all healthy minds to be decent and self-controlled, to abstain from sin and fight against temptation; but they oppose the Lord 1 their God, and take the Devil’s part, assisting him in his evil work by indulging in all deadly lusts; so they commit grievous sins in their amours.J"
765,وقد علمنا أن الله عز وجل ركَّب في الإنسان طبيعتين متضادتين؛ إحداهما لا تُشير إلا بخير، ولا تحُضُّ إلا على حسن، ولا يُتَصوَّر فيها إلا كل أمر مَرْضيٍّ، وهي العقل، وقائده العدل.,"We know that Allah has implanted in every man two opposed natures. The first of these counsels only good; and incites to what is fair and seemly, so that nothing that is not pleasing to God is conceived therein: this – is reason, which is guided and led by justice."
766,والثانية ضدٌّ لها، لا تشير إلا إلى الشهوات، ولا تقود إلا إلى الردى، وهي النفس، وقائدها الشهوة، والله تعالى يقول: {إِنَّ النَّفْسَ لَأَمَّارَةٌ بِالسُّوءِ}، وكنَّى بالقلب عن العقل فقال: {إِنَّ فِي ذَلِكَ لَذِكْرَى لِمَن كَانَ لَهُ قَلْبٌ أَوْ أَلْقَى السَّمْعَ وَهُوَ شَهِيدٌ}، وقال تعالى: {حَبَّبَ إِلَيْكُمُ الْإِيمَانَ وَزَيَّنَهُ فِي قُلُوبِكُمْ}. وخاطب أولي الألباب.,"The second is opposite to the first, in that it advises solely the gratification of the lusts, and leads the way to all, that is evil and vicious: this is the soul; whose guide and mentor is carnal passion. God says, “Verily the soul commands to evil” (Koran XII 53). Elsewhere Allah refers to reason, calling it the heart, and says, “Verily therein is a reminder to every man possessing a heart or lending an ear to hear, who beareth witness” (Koran L 36); He also says, “And He has made Faith a thing to be loved by you, and has made it comely in your hearts” (Koran XLIX 7); in another place He addresses “those that are possessed of minds” (Koran XXXIX 22)."
767,فهاتان الطبيعتان قُطبان في الإنسان، وهما قُوتان من قُوى الجسد الفعَّال بهما، ومطرحان من مَطارح شُعاعات هذين الجوهرين العجيبين الرفيعين العُلويين؛ ففي كل جسد منهما حظُّه على قدر مُقابلته لهما في تقدير الواحد الصمد، تقدَّست أسماؤه، حين خَلَقه وهيَّأه، فهما يتقابلان أبدًا ويتنازعان دأبًا، فإذا غلب العقلُ النفسَ ارتدع الإنسان، وقمَع عوارضه المَدخولة واستضاء بنور الله واتبع العدل، وإذا غلبت النفسُ العقلَ عميت البصيرة، ولم يصحَّ الفرقُ بين الحسن والقبيح، وعَظُم الالتباس، وتردَّى في هُوَّة الرَّدى ومَهواة الهَلكة، وبهذا حَسُن الأمر والنهي، ووجب الاكتمال، وصحَّ الثواب والعقاب، واستُحق الجزاء.,"These two contrary natures are the poles in a man; they are two of the body’s various faculties, by means of which the body acts; they are so to speak a pair of screens, upon which fall the rays emanating from those two wonderful, lofty, sublime substances. Every body has its share in these two natures, according to the degree to which it responds to them, its receptiveness being determined by the eternal will of the One Everlasting God (Holy be His Names), at the time that He created it and gave it shape. The two natures are forever and habitually in opposition and conflict one with the other. When the reason prevails over the soul, a man will refrain, and rein his corrupt impulses; he will seek to be illumined by the light of God, and will follow after justice. But when the soul dominates the reason, his inward eye is so blinded that he cannot truly discriminate between what is seemly and what is vile; great is his confusion, and he falls into the pit of ruin and the bottomless abyss of destruction. Therefore are God’s commands and prohibitions most excellent, and obedience to them man’s bounden duty, upon the fulfillment of which depends his fitting reward or punishment, his well-merited recompense."
768,والروح واصل بين هاتين الطبيعتين، ومُوصِّل ما بينهما، وحامل الالتقاء بهما.,"The spirit unites these contrary natures, and acts as a link and meeting-point between them."
769,وإن الوقوف عند حدِّ الطاعة لمعدوم إلا بطُول الرياضة، وصحة المعرفة، ونفاذ التمييز، ومع ذلك اجتناب التعرض للفِتَن ومُداخلة الناس جملة، والجلوس في البيوت، وبالحريِّ أن تقع السلامة المضمونة، أو يكون الرجل حَصورًا لا أرب له في النساء، ولا جارحة له تُعينه عليهن قديمًا.,"To stand always within the confines of obedience is a thing outside the bounds of actuality, except it be achieved by long self-discipline, right knowledge, and penetrating decimation; and only then may it be attained if a man deliberately avoids exposing himself to seduction, and abstains from human intercourse entirely, sitting not within the tents of temptation. Without doubt perfect and absolute purity can be secured, if a man were to be castrated and thus have no desire for woman, and no organ to assist him to traffic with them."
770,ووَرَد: من وُقي شرَّ لَقْلقه وقَبْقبه وَذبْذبه، فقد وُقي شَرَّ الدنيا بحذافيرها. واللقلق: اللسان، والقبقب: البطن، والذبذب: الفرج.,"It was said of old, “He who is preserved from the evil of his clacker, his rumbler and his dangler, is saved from the evil of the whole sublunary world.” The clacker is the tongue, the rumbler is the belly, an the dangler is the privy parts."
771,ولقد أخبرني أبو حفص الكاتب — هو من ولد رَوح بن زِنباع الجذامي — أنه سمع بعض المُتَّسمين باسم الفقه من أهل الرواية المشاهير وقد سُئل عن هذا الحديث فقال: القبقب: البطيخ.,"On the other hand I was told by Abu Hafs the civil secretary, a descendant of Rauh Ibn Zinba’ al udhami, that he asked a noted jurist, who was also an eminent Traditionist, to explain the foregoing saying to him; and he told him that the word which I have glossed as “belly” actually means “melon”."
772,وحدثنا أحمد بن محمد بن أحمد، حدثنا وهب بن مَسرة ومحمد بن أبي دليم، عن محمد بن وضَّاح، عن يحيى بن يحيى، عن مالك بن أنس، عن زيد بن أسلم، عن عطاء بن يسار، أن رسول الله ﷺ قال في حديث طويل: مَن وقاه الله شرَّ اثنتين دخل الجنة. فسُئل عن ذلك فقال: ما بين لِحْيَيه وما بين رِجْلَيه.,"Ahmad Ibn Muhammad Ibn Ahmad informed me, transmitting from Wahb Ibn Masarra and Muhammad Ibn Abi Dulaim, from Muhammad Ibn Waddah, from Yahya Ibn Yahya, from Malik Ibn Anas, from Zaid Ibn Aslam, from ‘Ata’ Ibn Yasar, that the Prophet of Allah said (I extract this from a long Tradition), “He whore Allah preserves from the evil of two things shall surely enter Paradise.” When asked to explain this saying, he added, “That which lies between his moustache and beard, and that which lies between his two legs.”"
773,وإني لأسمع كثيرًا ممن يقول: الوفاء في قمع الشهوات في الرِّجال دون النساء. فأُطيلُ العجب من ذلك، وإنَّ لي قولًا لا أحول عنه: الرجال والنساء في الجنوح إلى هذين الشيئين سواء، وما رجل عرضت له امرأة جميلة بالحُبِّ وطال ذلك ولم يكن ثَمَّ من مانعٍ إلا وقع في شَرَك الشيطان، واستهوتْه المعاصي، واستفزَّه الحرص، وتَغوَّله الطمع، وما امرأة دعاها رجل بمثل هذه الحالة إلا وأمكنتْه، حتمًا مَقضيًّا، وحكمًا نافذًا لا محيد عنه البتة.,"I hear many people say, “Complete subjugation of the passions is found only among men, and not among women.” I never cease to wonder at this assertion. My own unwavering opinion is, that men and women are exactly equal in their inclination towards these two things. The man does not exist who, having been offered the love of a pretty woman a long time, and there being no obstacle to prevent him, will not fall into Satan’s net, will not be seduced by sin, and will not be excited by desire and led astray by concupiscence. Similarly there is no woman who, if invited by a man in the selfsame circumstances, will not surrender to him in the end; it is the absolute law and inescapable decree of destiny."
774,ولقد أخبرني ثقةٌ صدق من إخواني من أهل التَّمام في الفقه والكلام والمعرفة، وذو صلابة في دينه، أنه أحب جاريةً نبيلةً أديبةً ذات جمال بارع، قال: فعرضتُ لها فنفرتْ، ثم عرضتُ فأبتْ، فلم يزل الأمر يطول وحبُّها يزيد وهي لا تُطيع البتة، إلى أن حملني فرط حبي لها مع عَمَى الصِّبَى على أن نذرتُ أني متى نلتُ منها مرادي أن أتوب إلى الله توبةً صادقةً. قال: فما مَرَّت الأيام والليالي حتى أذعنت بعد شماس ونفار.,"I have been informed by a most truthful and trustworthy friend -I may add that he has a perfect acquaintance with jurisprudence, scholastic theology and science, and is firm in his observance of the faith- that he once loved a superior and cultured girl of dazzling beauty. “I made a proposal to her”, he told me, “and she refused in horror. I repeated my proposal, and she again declined. So matters went on for a long time, and all the while my love for her waxed stronger; but she was not one of the kind that submits to solicitations. Finally I was so carried away by my excessive passion for her, that being a blind and headstrong youth, I made a vow that if I succeeded in having my way with her, I would thereafter turn to Allah in true and contrite penitence. As the days and nights went by, after all her stubborn refusal and aversion she at last gave in to me.”"
775,فقلت له: أبا فلان، وفيتَ بعهدك؟ فقال: إي والله. فضحكتُ. وذكرتُ بهذه الفَعلة ما لم يزل يُتداول في أسماعنا من أن في بلاد البربر التي تجاوز أندلسنا يتعهد الفاسق على أنه إذا قضى وطره ممن أراد أنْ يتوب إلى الله، فلا يُمنع من ذلك، ويُنكرون على من تعرَّض له بكلمة ويقولون له: أتحرم رجلًا مسلمًا التوبة؟,"I said to my friend, “O father of one who shall be unnamed, did you fulfill your engagement?” “Yes, by Allah”, he replied. Thereupon I laughed, being reminded by his action of a report commonly noised among us, that in the Berber country adjacent to Andalusia fornicators repent of their sins on condition that they attain gratification of their immediate desires. Nothing is done to prevent this curious conduct; on the contrary, they disapprove strongly in that country if any man ventures to utter even one word of protest, saying, “What, would you make it impossible for a Mussulman to repent?”"
776,قال: ولعهدي بها تبكي وتقول: والله لقد بلَّغتني مبلغًا ما خَطَر قطُّ لي ببالٍ، ولا قدرتُ أن أجيب إليه أحدًا.,"My friend continued, “I well recall how she wept, saying, ‘By Allah, you have brought me to a pass I never in my life thought to come to, nor supposed that I would concede it to any man.'”"
777,ولست أُبعد أن يكون الصلاح في الرجال والنساء موجودًا، وأعوذ بالله أن أظن غير هذا، وإني رأيت الناس يَغلطون في معنى هذه الكلمة — أعني الصلاح — غلطًا بعيدًا.,"I do not consider it utterly remote from all possibility that righteousness should exist among men, and women too: God forbid, that I should have any such thoughts! But I have observed that many men err gravely as to the true meaning of the word “righteousness”."
778,والصحيح في حقيقة تفسيرها أن الصالحة من النساء هي التي إذا ضُبطت انضبطت، وإذا قُطعت عنها الذرائع أمسكت، والفاسدة هي التي إذا ضُبطت لم تَنضبط، وإذا حيل بينها وبين الأسباب التي تُسَهِّل الفواحش تحيَّلت في أن تتوصل إليها بضروب من الحيل، والصالح من الرجال من لا يُداخل أهل الفسوق، ولا يتعرَّض إلى المناظر الجالبة للأهواء، ولا يرفع طرفه إلى الصور البديعة التركيب، والفاسق من يعاشر أهل النقص، وينشُر بصره إلى الوجوه البديعة الصنعة، ويتصدى للمشاهد المؤذية، ويحب الخلوات المهلكات، والصالحانِ من الرجال والنساء كالنار الكامنة في الرماد لا تحرق من جاورها إلا بأن تُحَرَّك، والفاسقانِ كالنار المشتعلة تحرق كل شيء.,"Its correct interpretation is as follows. The “righteous” woman is one who, when duly restrained, restrains herself; when temptations are kept out of her way, she keeps herself under control. The “wicked” woman on the other hand is one who, when duly restrained, does not restrain herself, and when barred from all facilities for committing licence, nevertheless herself contrives by some ruse or other to discover the means of behaving badly. The “righteous” man is he who has no traffic with adulterers, and does not expose himself to sights exciting the passions; who does not raise his eyes to look upon ravishing shapes and forms. The “wicked” man however is he who consorts with depraved people, who allows his gaze to wander freely and stares avidly at beautiful faces, who seeks out harmful spectacles and delights in deadly privacies. The “righteous” man and the” righteous woman are like a fire that lies hidden within the ashes, and does not burn any who is within range of it unless it be stirred into flame. But “wicked” men and women are like a blazing, all-consuming conflagration."
779,وأما امرأة مهملة ورجل متعرض فقد هلكا وتلفا؛ ولهذا حُرِّم على المسلم الالتذاذ بسماع نغمة امرأة أجنبية، وقد جُعلت النظرة الأولى لك والأخرى عليك.,"As for the abandoned woman and the adventurous man, they are surely doomed to everlasting destruction. For this reason it is forbidden to a Moslem to take delight in listening to a foreign woman sing: “the first glance is for you, the second glance is against you”."
780,وقد قال رسول الله ﷺ: «من تأمل امرأة وهو صائم حتى يرى حَجم عظامها فقد أفطر».,"The Prophet of Allah said, “Whoever looks upon a woman when he is fasting, so as to see the bulk of her bones, the same has broken the fast.”"
781,وإن فيما ورد من النهي عن الهوى بنصِّ التنزيل لشيئًا مقنعًا، وفي إيقاع هذه الكلمة — أعني الهوى — اسمًا على معانٍ، واشتقاقها عند العرب، وذلك دليل على ميل النفوس وهويِّها إلى هذه المقامات، وإن المتمسك عنها مُقارع لنفسه، مُحارب لها.,"The clear texts set down in Holy Writ forbidding the indulgence of passion are surely amply convincing. The wide variety of meaning attaching to this word “passion”, and the derivation assigned to it by the Arabs, prove well enough the inclination and the aspiration of the carnal soul towards these situations; and the man who holds himself back from them must needs struggle and fight against his lower self."
782,وشيء أصفه لك تراه عِيانًا، وهو أني ما رأيت قط امرأة في مكانٍ تُحسُّ أن رجلًا يراها أو يسمع حسَّها إلا وأحدثت حركةً فاضلةً كانت عنها بمعزل، وأتت بكلام زائد كانت عنه في غُنية، مخالفَينِ لكلامها وحركتها قبل ذلك، ورأيت التهمُّم لمخارج لفظها وهيئة تقلُّبها لائحًا فيها ظاهرًا عليها لا خفاء به، والرجال كذلك إذا أحسوا بالنساء.,"I will describe something to you which you ma readily enough observe with your own eyes. I have never seen the woman who, happening to be in some place where she senses that a man is looking at her or listening to her voice, does not make some wholly superfluous gesture, remote from her usual habit, or offer some entirely gratuitous remark with which she would otherwise have dispensed, in either case quite at variance with have she was talking or behaving immediately before. I have noticed -and indeed the matter is only too apparent and obvious, and there is no concealing it- that she will take great pains how she articulates her words, and will pay elaborate attention to the manner in which she varies her postures. It is the same with men, as soon as they sense the presence of ladies."
783,وأما إظهار الزينة وترتيب المشي وإيقاع المزح عند خُطور المرأة بالرجل، واجتياز الرجل بالمرأة؛ فهذا أشهر من الشمس في كل مكان، والله عز وجل يقول: {قُل لِّلْمُؤْمِنِينَ يَغُضُّوا مِنْ أَبْصَارِهِمْ وَيَحْفَظُوا فُرُوجَهُمْ}، وقال تقدَّست أسماؤه: {وَلَا يَضْرِبْنَ بِأَرْجُلِهِنَّ لِيُعْلَمَ مَا يُخْفِينَ مِن زِينَتِهِنَّ}.,"As for showing off one’s finery, and studying one’s deportment, and engaging in pleasantries when woman is approaching a man, or a man is passing by a woman, that is more evident than the sun in heaven, and happens everywhere. Allah the Almighty says, “Say unto the believers, that they lower their eyes and conceal their private parts” (Koran XXIV 30); He also says, “And let the women not tap with their feet, that their hidden ornaments may be made known” (Koran XXIV 3I)."
784,فلولا علم الله عز وجل برقة إغماضهن في السعي لإيصال حُبهن إلى القلوب، ولُطف كيدهن في التحيُّل لاستجلاب الهوى، لما كشف الله عن هذا المعنى البعيد الغامض الذي ليس وراءه مرمًى، وهذا حد التعرُّض فكيف بما دونه!,"Were it not that Allah is aware of the delicate way in which women droop their eyelids when striving to win the affection of men’s hearts, and the subtle ruses they employ in contriving to attract men’s desires, never would He have revealed a notion so infinitely remote and abstruse. This is the limit beyond which one may not prudently expose oneself to danger: how then shall it be with a man if he adventure further?"
785,ولقد اطلعت من سرِّ معتقد الرجال والنساء في هذا على أمر عظيم، وأصل ذلك أني لم أحسن قط بأحد ظنًّا في هذا الشأن، مع غَيرة شديدة رُكِّبت فيَّ.,"I tell you that I have penetrated most deeply into the secret thoughts of men and women in this matter, the fact is that I never had a very good opinion of anyone where these things are concerned; besides, I must confess that I am constitutionally a very jealous man."
786,وحدَّثنا أبو عمرو أحمد بن محمد بن أحمد، حدَّثنا أحمد، حدَّثنا محمد بن علي بن رفاعة، حدَّثنا علي بن عبد العزيز، حدَّثنا أبو عبيد القاسم بن سلام عن شيوخه، أن رسول الله ﷺ قال: الغَيْرة من الإيمان.,"Abu `Umar Ahmad Ibn Muhammad Ibn Ahmad informed me, transmitting from Ahmad, from Muhammad Ibn `Ali Ibn Rafa` a from `Ali Ibn `Abd al-`Aziz, from Abu ‘Ubaid al-Qasim Ibn Sallam, from his teachers, that the Prophet of Allah said, “Jealousy is a part of faith.”"
787,فلم أزل باحثًا عن أخبارهن، كاشفًا عن أسرارهن، وكن قد أنسنَ منِّي بكتمان، فكنَّ يُطْلِعنني على غوامض أمورهن.,"That is why I have never ceased to pry into stories about women, and to lay bare their secrets. They have known well my discretion, and have therefore not hesitated to apprise me of their most hidden affairs."
788,ولولا أن أكون مُنبِّهًا على عوراتٍ يُستعاذ بالله منها لأوردتُ من تنبههن في السرِّ ومكرهن فيه عجائب تُذهل الألباب.,"But for the fear of exposing their shames from which may God preserve me! I would have set down such marvels illustrating their lively awareness of evil, and their cunning in contriving naughtiness, as would confound the most intelligent of men."
