,Arabic,English
546,وفي ذلك أقول قصيدةً، منها:  وَذِي عِلَّةٍ أَعْيَا الطَّبِيبَ عِلَاجُهَا *** سَتُورِدُنِي لَا شَكَّ مَنْهَلَ مَصْرَعِي رَضِيتُ بِأَنْ أُضْحِي قَتِيلَ وِدَادِهِ *** كَجَارِعِ سُمٍّ فِي رَحِيقٍ مُشَعْشعِ فَمَا لِلَّيَالِي، مَا أَقلَّ حَيَاءَهَا *** وَأَوْلَعَهَا بِالنَّفْسِ مِنْ كُلِّ مُولَع كَأَنَّ زَمَانَي عَبْشَمِيٌّ يَخَالُنِي *** أَعَنْتُ عَلَى عُثْمَانَ أَهْلَ التَّشَيُّعِ,"I have a long poem on this topic, in which the following verses occur.  Ah me, the languor of her eyes, The sickness baffling doctors’ skill, That leads me, as no doubt it will, To waters where the drinker dies.  I am contented to be slain, A ready victim to her love, As one who swallows poison of The sparkling wine he yearns to drain.  Alas, how little was their shame, Those endless nights I sleepless lay, Eager to steal my soul away, Poor plaything of their ruthless game.  Some ‘Abshami my fate must be, ‘Uthman’s revengeful kinsman, who, Supposing me to `Ali true, Would slay me for complicity."
547,وأقول من قصيدة:  أَظُنُّكَ تِمْثَال الجِنَانِ أَبَاحَهُ *** لِمُجْتَهِدِ النُّسَّاكِ مِنْ أَوْلِيَائِهِ  وأقول من قصيدة:  لأبْرد بِاللُّقْيَا غَلِيلًا مِنَ الهَوَى *** تَوَقَّع نِيرَان الغَضَى هَيمَانه  وأقول شعرًا، منه:  خَفِيت عن الأَبْصَارِ وَالوَجْدُ ظَاهِرٌ *** فَاعْجبْ بِأَعْرَاضٍ تَبِينُ وَلَا شَخْص غَدَا الفَلَكُ الدَّوَّارُ حَلْقَةَ خَاتَمٍ *** مُحِيطٍ بِمَا فِيهِ وَأَنْتِ لَهُ فَص,"In another poem I say  I think thou art a likeness true Of Paradise, that rich reward Assigned by loving Allah to His saints, who labour for their Lord.  Elsewhere I say  That I may slake, in meeting thee, This passion’s thirst that burns in me, This conflagration of desire Inflamed like tamarisk afire.  And elsewhere  I vanished out of human ken, My passion patent yet to men O strange, apparent accidents Whose body is remote from sense!  The heavens all-encompassing Spin ever like some giant ring Thou, centred at the circle’s heart, Its coruscating bezel art."
548,وأقول من قصيدة:  غَنِيت عَن التَّشْبِيهِ حُسْنًا وَبَهْجَةً *** كَمَا غَنِيت شَمْسُ السَّمَاءِ عَنِ الحَلْي عَجِبْتُ لِنَفْسِي بَعْدَهُ كَيْفَ لَمْ تَمُتْ *** وهجْرَانُهُ دَفْنِي وَفُقْدَانُهُ نَعيي وَلِلْجَسَدِ الغَضِّ المُنَعَّمِ كَيْفَ لَمْ *** تُذِبْهُ يَدٌ خَشْنَاء … …,"Elsewhere again I have these stanzas.  Thou, with such loveliness endued, Transcendest all similitude The sun, resplendent in the skies, Upon no ornament relies.  (I marvel how my soul lives on, And did not die when he was gone His parting meant the tomb for me, His loss was my obituary.  I wonder at my body, yet So tender and so delicate, Such shocks still able to withstand, Unwithered by Fate’s cruel hand)."
549,وإنَّ للأوبة من البَيْن الذي تُشفق منه النفس لِطُول مسافته، وتكاد تيأس من العودة فيه لروعةً تبلغ ما لا حدَّ وراءه، وربما قتلت. وفي ذلك أقول:  لِلتَّلَاقِي بَعْدَ الفِرَاقِ سُرُورٌ *** كَسُرُورِ المُفِيقِ حَانَتْ وَفَاتُهْ فَرْحَةٌ تُبْهِجُ النُّفُوسَ وَتُحْيي *** مَنْ دَنَا مِنْهُ بِالفرَاقِ مَمَاتُه رُبمَا قَدْ تَكُونُ دَاهِيَةُ المَوْ *** تِ وَتُودِي بِأَهلِهِ هَجَمَاتُه كم رأينا مَن عَبَّ في الماء عطشا *** نَ فزارَ الحِمام وهو حَياتُه!,"But to return after a separation so prolonged that the soul is filled with disquietude, and wellnigh despairs of ever coming back again-that is a joyous surprise surpassing all bounds; indeed its impact is sometimes fatal. This is how I have described it in verse.  After parting to unite Is a wonder of delight, Such as his, who issueth From the very jaws of death.  This rejoices the poor heart Languishing so long apart, Brings to life the lover, nigh (In his loneliness) to die.  Yet such ecstasy of joy, When too sudden, can destroy, And its onslaught prove his doom, Lay the lover in the tomb.  Sometimes travellers athirst Gulp the waters till they burst, And the liquid that should save From expiring, is their grave."
550,وإني لأعلم مَن نأت دارُ محبوبه زمنًا ثم تيسَّرت له أوبة، فلم يكن إلا بقَدْر التسليم واستيفائه، حتى دعتْه نوًى ثانية فكاد أن يَهلِك. وفي ذلك أقول:  أَطَلْتُ زَمَانَ البُعْدِ حَتَّى إِذَا انْقَضَى *** زَمَانُ النَّوَى بِالقُرْبِ عُدْتَ إِلَى البُعْدِ فَلَمْ يَكُ إِلَّا كَرَّة الطَّرْفِ قُرْبَكُمْ *** وَعَاوَدَكُمْ بَعْدِي وَعَاوَدَنِي وَجْدِي كَذَا حَائِرٌ فِي اللَّيْلِ ضَاقَتْ وُجُوهُهُ *** رَأَى البَرْقَ فِي دَاجٍ مِنَ اللَّيْلِ مُسْوَدِّ فَأَخلَفهُ مِنهُ رَجاءُ دَوامِه *** وبَعضُ الأرَاجِي لا تُفيدُ ولا تُجدِي,"I put this drama into rhyme.  A weary while afar I spent Till, when my time of banishment Was done, and I stood nigh to you, I must perforce remove anew.  For but the twinkling of an eye My happiness, and you, were nigh, Then I deserted you again, To be revisited by pain.  So, when the traveller, astray And sorely vexed to find his way, Beholds the levin’s sudden light Illuminate the inky night  He hopes for its perpetual gleam, But he is cheated of his dream; And many hopes do but deceive, And dreams exhilarate, to grieve."
551,وفي الأوبة بعد الفراق أقول قطعةً، منها:  لَقَدْ قَرَّتِ العَيْنَانِ بِالقُرْبِ مِنْكُمُ *** كَمَا سَخُنَتْ أَيَّام يَطْوِيكُمُ البُعْدُ فَلله فِيمَا قد مَضَى الصَّبْرُ وَالرِّضَى *** وَلله فِيمَا قَدْ قَضَى الشُّكْرُ وَالحَمْدُ,"On the theme of returning after separation I have these lines.  My eyes were cooled with gladness, when I came to dwell with you again But while you were afar, ah then My eyes were hot with burning pain.  I offer God for what is gone A spirit patient and resigned, As too, for what ensued thereon, The praises of a grateful mind."
552,خبر ولقد نُعي إليَّ بعضُ مَن كنتُ أحبُّ من بلدة نازحة، فقمتُ فارًّا بنفسي نحو المقابر وجعلتُ أمشي بينها وأقول:  وَدِدْتُ بِأَنَّ ظَهْرَ الأَرْضِ بَطْنٌ *** وَأَنَّ البَطْنَ مِنْهَا صَارَ ظَهْرَا وَأَنِّي مِتُّ قَبْلَ وُرُودِ خَطْبٍ *** أَتَى فَأَثَارَ فِي الأَكْبَادِ جَمْرا وَأَنَّ دَمِي لِمَنْ قَدْ بَانَ غُسْلٌ *** وَأَنَّ ضُلُوعَ صَدْرِي كُنَّ قبرا,"News was brought to me of the death in a distant city of one I loved. I arose and fled to the cemetery, where I paced up and down among the graves, reciting the following verses.  I would this earth without Were wholly turned about, And that which lies below Were mine wherein to go.  Would Death had ravished me, Ere this calamity Upon my spirit came, And set my heart aflame.  Would all my blood were shed To lave my dearest dead, And in my hollow breast His body lay at rest."
553,ثم اتصل بعد حينٍ تكذيبُ ذلك الخبرِ، فقلت:  بُشْرى أَتَتْ وَاليَأْسُ مُسْتَحْكم *** وَالقَلْبُ فِي سَبْعٍ طِبَاقٍ شِدَادِ كَسَتْ فُؤَادِي خُضْرَة بَعْدَمَا *** كَانَ فُؤَادِي لَابِسًا لِلحِدَادِ جَلَّى سَوَادَ الغَمِّ عَنِّي كَمَا *** يُجْلَى بِلَوْنِ الشَّمْسِ لَوْنُ السَّوَاد هَذَا وَمَا آمُلُ وَصْلًا سِوَى *** صِدْقِ وَفَاءٍ بِقَدِيمِ الوِدَادِ فَالمُزْنُ قَدْ تُطْلَبُ لَا لِلْحَيَا *** لَكِنْ لِظِلٍّ بَارِدٍ ذِي امْتِدَادِ,"A little while later I learned that those tidings were false; and in joy I set pen to paper again and fashioned this poem.  Joy came, when desperate woe Was now established well; My heart was clapt below The seven tiers of hell.  Joy clothed in living green The heart within my breast, This heart that long had been In garb of mourning dressed.  The black of sullen gloom Removed, as when the bright Sun floods a shuttered room And fills it all with light.  And yet I dare not look For other union, save The ancient oath I took, The plight of love you gave.  So men will pray for cloud, Not hoping for sweet rain, But that in its spread shroud Cool shelter they may gain."
554,ويقع في هذين الصنفين من البَينِ الوداعُ؛ أعني رحِيلَ المُحب أو رحيل المحبوب.,"In these two sorts of separation the leave-taking occurs, that is to say when the lover or the beloved sets forth upon a journey."
555,وإنه لمن المناظر الهائلة والمواقف الصعبة التي تَفتضح فيها عزيمة كل ماضي العزائم، وتذهب قوة كل ذي بصيرة، وتَسكب كلُّ عينٍ جمود، ويَظهر مكنون الجوى.,"That is a most moving spectacle, a very painful scene which tests to breaking-point the resolution of even the strongest will ; the power of the most perspicacious vanishes ; the driest eye is bathed in tears ; the deepest-hidden passion is exposed to the light of day."
556,ولعمري لو أن ظريفًا يموت في ساعة الوداع لكان معذورًا إذا تفكَّر فيما يَحُلُّ به بعد ساعة من انقطاع الآمال، وحلول الأوجال، وتبدُّل السرور بالحزن.,"By my life, if a sensitive man should expire in the hour of leave-taking he might well be excused, when he reflects upon the situation in which he will find himself after all his hopes are shattered, and terrors grip his soul, and joy is turned to sorrow."
557,وإنها ساعة تُرِقُّ القلوب القاسية، وتُلين الأفئدة الغلاظ.,"It is an hour to soften the hardest heart, to melt the most unfeeling breast."
558,وإن حركة الرأس وإدمان النظر والزَّفرة بعد الوداع لهاتكةٌ حجابَ القلب، ومُوصلة إليه من الجزع بمقدار ما تفعل حركةُ الوجه في ضد هذا. والإشارة بالعين والتبسُّم في مواطن المُوافقة والوداع ينقسم قسمين؛ أحدهما لا يتمكَّن فيه إلا بالنظر والإشارة، والثاني يتمكن فيه بالعناق والملازمة، وربما لعلَّه كان لا يُمكن قبل ذلك البتة مع تجاور المحال وإمكان التلاقي؛ ولهذا تمنَّى بعضُ الشعراء البَيْنَ ومدَحوا يوم النَّوَى، وما ذاك بحَسن ولا بصواب ولا بالأصيل من الرأي؛ فما يفي سرورُ ساعة بحزن ساعات، فكيف إذا كان البين أيامًا وشهورًا وربما أعوامًا!,"The shaking of the head, the long unwavering stare, the sighs that follow after farewell tear aside the veil of the heart, and admit into its sanctuary disquietude as great as the agitation provoked in the contrary case by the animated countenance, the winks, the smiles, and all the other manifestations of loving harmony. There are two kinds of leave-taking. In the first, there is no other possibility of demonstrating the emotions but by means of glances and signs; in the second, embracing and hugging are possible, which for some reason or other may not have been the case before, despite the propinquity of dwellings and the feasibility of the lovers meeting. Therefore some poets have wished for separation, and have praised the day of parting; but that is neither beautiful, right, nor well founded. The joy of one hour does not compensate for the sorrow of several; how then will it be if the separation should continue for days, months, perhaps years?"
559,وهذا سوء من النظر ومعْوجٌّ من القياس، وإنما أثنيتُ على النوى في شعري تمنِّيًا لرجوع يومها، فيكون في كل يوم لقاء ووداع.,"That is indeed an evil speculation and a -crooked- logic. Where I have praised parting myself in my poetry, it has only been because I yearned for the day of parting to return, so that upon everyday there might be a reunion and a farewell."
560,على أن تَحمُّل مضض هذا الاسم الكريه، وذلك عندما يمضي من الأيام التي لا التقاء فيها، يرغِّب المحب عن يوم الفراق لو أمكنه في كل يوم. وفي الصنف الأول من الوداع أقول شعرًا، منه:  تَنُوبُ عَنْ بَهْجَةِ الأَنْوَارِ بَهْجَتُهُ *** كَمَا تَنُوبُ عَن النِّيرَانِ أَنْفَاسِي,"The pain occasioned by this hateful name can be endured, especially if several days have elapsed in which no meeting has taken place; for then the lover actually longs for the day of separation, and wishes it might happen every day. On the first type of leave-taking I have this stanza.  Her loveliness is deputy For the sweet loveliness of light, As substitute the sighs in me For flaming embers burning bright."
561,وفي الصنف الثاني من الوداع أقول شعرًا، منه:  وَجْهٌ تَخِرُّ لَهُ الأَنْوَارُ سَاجِدَةً *** وَالوَجْهُ تِمٌّ فَلَمْ يَنْقُصْ وَلَمْ يَزِدِ دِفْءٌ وَشَمْسُ الضُّحَى بِالجَدْيِ نَازِلَةٌ *** وَبَارِدٌ نَاعِمٌ وَالشَّمْسُ فِي الأَسَدِ,"I describe the second sort of leave-taking thus.  Before her face resplendent all The lights of heaven prostrate fall, A face of perfect loveliness Augmenting not, nor growing less.  A grateful warmth, as when at morn The sun is lodged in Capricorn, A gentle coolness, when the sun In Leo has his journey run."
562,ومنه:  يَوْمُ الفِرَاقِ لَعَمْرِي لَسْتُ أَكْرَهُهُ *** أَصْلًا وَإِنْ شَتَّ شَمْلُ الرُّوحِ عَنْ جَسَدِي فَفِيهِ عَانَقْتُ مَنْ أَهْوَى بِلَا جَزَعٍ *** وَكَانَ مِنْ قَبْلِهِ إِنْ سِيلَ لَمْ يَجُدِ أَلَيْسَ مِنْ عَجَبٍ دَمْعِي وَعَبْرَتِهَا *** يَوْمُ الوِصَالِ لِيَوْمِ البَيْنِ ذُو حَسَدِ,"Later in the same poem I have these stanzas.  Upon my life, I do not hate The day when lovers separate, Not fundamentally, although My soul doth from my body go.  On such a day I took my leave Of her I love, yet did not grieve, Since she embraced me, which before She would not, though I might implore.  Is it not strange and marvelous, The lesson this can teach to us? The hour of separation may Be envied well by union’s day!"
563,وهل هجس في الأفكار أو قام في الظنون أشنعُ وأوجع من هَجر عِتاب وقع بين مُحبَّين، ثم فجأتْهما النوى قبل حلول الصُّلح وانحلال عُقدة الهجران، فقاما إلى الوداع وقد نُسي العِتاب، وجاء ما طَمَّ على القُوى وأطار الكرى. وفيه أقول شعرًا، منه:  وَقَدْ سَقَطَ العَتبُ المُقَدَّمُ وَامَّحَى *** وَجَاءَتْ جُيُوشُ البَيْنِ تَجْرِي وَتُسْرِعُ وَقَدْ ذَعَرَ البَيْنُ الصُّدُودَ فَرَاعَهُ *** فَوَلَّى فَمَا يُدْرَى لَهُ اليَوْمَ مَوْضِعُ كَذِئْبٍ خَلَا بِالصَّيْدِ حَتَّى أَضَلَّهُ *** هِزَبْرٌ لَهُ مِنْ جَانِبِ الغِيلِ مَطْلعُ لَئِنْ سَرَّنِي فِي طَرْدِهِ الهَجْرَ إِنَّنِي *** لإِبْعَادِهِ عَنِّي الحَبِيبَ لَمُوجَع وَلَا بُدَّ عِنْدَ المَوْتِ مِنْ بَعْضِ رَاحَةٍ *** وَفِي غَيِّهَا المَوْتُ الوَحِيِّ المُصَرِّعُ,"Could anything more frightful be conceived, or could aught more painful enter into the thoughts of man, than that two lovers should break off their relations with reproaches, and then be overtaken by a sudden parting before reconciliation can be effected and the tangled knot of desertion be resolved? Imagine their feelings as they stand to bid adieu to one another: all reproaches are forgotten in the face of this catastrophe, which has overwhelmed their faculties and banished sleep from their eyes. I have been inspired to put, this situation into a poem.  Now silenced is the voice of blame, All blotted out the old reproach Lo, separation’s troops approach With speedy and unflinching aim.  Estrangement, scared and terrified By separation, flees away, And none can tell, this dreadful day, Where it may find a place to hide.  So might some wolf, in lone delight Stalking its prey, all suddenly A lion in the offing see Beside the copse, and take to flight.  If separation makes me glad Because estrangement’s at an end, Yet it removes me from my friend, And leaves me desolate and sad.  So, in the fearful hour of death, The dying man wins some repose; But then death’s angel, ere he knows, Assaults, and takes away his breath."
564,وأعرف من أتى ليُودِّع محبوبَه يوم الفِراق فوجده قد فات، فوقف على آثاره ساعةً وتردَّد في الموضع الذي كان فيه ثم انصرف كئيبًا متغيِّر اللون كاسف البال، فما كان بعد أيام قلائل حتى اعتلَّ ومات — رحمه الله.,"I know a man who came to bid farewell to his beloved upon the day of parting, and found that she was already gone. He paused in her tracks a full hour, passing to and fro over the spot where she had been; then he departed crestfallen, pale, dejected. Within a few days he fell sick and died, God rest his soul!"
565,وإن للبين في إظهار السرائر المطوية عملًا عجبًا، ولقد رأيتُ من كان حبُّه مكتومًا، وبما يَجِد فيه مستترًا حتى وقع حادث الفراق فباح المكنون وظهر الخفي. وفي ذلك أقول قطعةً، منها:  بَذَلْتَ مِنَ الوُدِّ مَا كُنْتَ قَبْلُ *** مَنَعْتَ وَأَعْطَيْتَنِيهِ جُزَافَا وَمَا لِي بِهِ حَاجَةٌ عِنْدَ ذَاكَ *** وَلَوْ جُدْتَ قَبْلُ بَلَغْتَ الشِّغَافَا وَمَا يَنْفَعُ الطِّبُّ عِنْدَ الحِمَامِ *** وَيَنْفَعُ قَبْلَ الرَّدَى مِنْ تِلَافَا,"Separation discloses deep-hidden secrets in a most marvelous way. I once saw a man whose love was strictly concealed, and who took every pains to keep his feelings out of sight, until the event of separation occurred; then that which was hidden became apparent, and that which was secret stood forth revealed. I wrote a poem on this, from which I will cite three stanzas.  Thou gayest me the love Thou hadst denied to me Ere then, and didst thereof Bestow abundantly.  I had no longer need Of what thou then didst pour, But had rejoiced indeed To taste of it before.  Drugs may have some avail Before the hour of doom: The best specifics fail To penetrate the tomb."
566,وأقول:  الآنَ إِذْ حَلَّ الفِرَاقُ جُدْتَ لِي *** بِخَفِيِّ حُبٍّ كُنْتَ تُبْدِي بُخْلَهُ فَزِدْتَنِي فِي حَسْرَتِي أَضْعَافَهَا *** ويحي فَهَلَّا كَانَ هَذَا قَبْلَهُ,"I have these verses also.  In this hour, when we must part, Thou bestowest, full and free, All the lode thy miser heart Treasured, but refused to me.  This thy sudden kindness yet Swells my sorrow more and more O the pity and regret! Why wast thou not kind before?"
567,ولقد أذكرني هذا أني حَظيتُ في بعض الأزمان بمودة رجل من وزراء السلطان أيام جاهه، فأظهر بعض الامتساك، فتركته حتى ذهبت أيامه وانقضت دولته، فأبدى لي من المودة والأُخوَّة غير قليل، فقلت:  بَذَلْتَ لِيَ الإِعْرَاضَ وَالدَّهْرُ مُقْبِلٌ *** وَتَبْذُلُ لِي الإِقْبَالَ وَالدَّهْرُ مُعْرِضُ وَتَبْسُطُني إِذْ لَيِسَ يَنْفَعُ بَسْطُكُمْ *** فَهَلَّا أَبَحْتَ البَسْطَ إِذْ كُنْتَ تَقْبِضُ,"Now this has-reminded me that at a certain time I enjoyed the affection of one of the sovereign’s viziers, during the days of his greatest glory. Then he manifested a certain reserve, and I kept away from him. In the hour when his triumph departed and his authority was at an end, he showed me not a little affection and comradeship; I countered his advances with the following well-chosen words.  When Dame Fortune smiled on thee Thou wast good enough to frown, But art gracious now to me, Seeing Fate has let thee down.  Thou wouldst be my friend again Now thy friendship has no use Why didst thou not give me then When it pleased thee to refuse?"
568,ثم بَينُ الموت؛ وهو الفوت، وهو الذي لا يُرجى له إياب، وهو المصيبة الحالَّة، وهو قاصمة الظهر، وداهية الدهر، وهو الويل، وهو المُغَطِّي على ظلمة الليل، وهو قاطع كل رجاء، وماحي كل طمع، والمؤيس من اللقاء.,"Finally there is the separation which is caused by death, that final parting from which there is no hope of a return. This is indeed a shattering and backbreaking blow, a fateful catastrophe; it is a lamentable woe, overshadowing the blackness of night itself; it cuts off every hope, erases all ambition, and causes the most sanguine to despair ‘of further meeting."
569,وهنا حادت الألسن، وانجذم حبل العلاج، فلا حيلة إلا الصبر طوعًا أو كرهًا.,"Here all tongues are baffled; the cord of every remedy is severed; no other course remains open but patient fortitude, willing or perforce."
570,وهو أجلُّ ما يُبتلى به المحبون، فما لمن دُهي به إلا النوح والبكاء إلى أن يتلَف أو يَملَّ، فهي القرحة التي لا تُنكى، والوجع الذي لا يفنى، وهو الغمُّ الذي يتجدَّد على قدر بلاء من اعتمدته، وفيه أقول:  كُل بَيْنٍ وَاقِعٍ *** فَمُرَجًّى لَمْ يَفُتْ لَا تعجل قَنطًا *** لَمْ يَفُتْ مَنْ لَمْ يَمُتْ وَالَّذِي قَدْ مَاتَ فَالْـ *** ـيَأْسُ عَنْهُ قَدْ ثَبتْ,"It is the greatest affliction that can assail true -lovers; and he who is struck down by it has nothing left but to lament and weep, until either he perishes himself or wearies of his lamentations. It is the wound, which cannot heal, the anguish which never passes, the sorrow which is constantly renewed, as ever his poor body crumbles that thou hast committed to the dust. On this matter I have the following to say.  What things soe’er May come to pass, Cry not alas While hope is there.  Haste not thy heart To gloom to yield All is not sealed Till life depart.  But when the veil Of death descends, Then all hope ends, All comforts fail."
