,Arabic,English
0,ذكر فتح مدينة بيت المقدس,March on Baytul Muqaddas (Jerusalem)
1,قال الواقدي: واما ما كان من المسلمين فانهم اقاموا على دمشق شهرا فجمع أبو عبيدة امراء المسلمين وقال لهم: أشيروا علي بما أصنع وأين أتوجه,"After the Muslim armies had been in Damascus for a month, Abu ‘Ubaydah summoned all the generals and said, “Advise me as to what I should do and where I should turn my attention to.”"
2,فاتفق رأي المسلمين أما إلى قيسارية وأما إلى بيت المقدس,It was decided between either Caesarea or Baytul Muqaddas.
3,فقال فما الذي ترون منهما,Abu ‘Ubaydah: So which of the two should it be?
4,فقالوا: أنت الرجل الأمين وما تسير إلى موضع إلا ونحن معك,Generals: You are the trusted one. Wherever you go we will follow.
5,فقال معاذ بن جبل اكتب إلى أمير المؤمنين عمر بن الخطاب فحيث أمرك فسر واستعن بالله,"Mu‘ath bin Jabal: Write to ‘Umar bin al-Khattab, the Commander of the Believers. Go wherever he tells you to and seek Allah’s help."
6,فقال أصبت الرأي يا معاذ فكتب إلى أمير المؤمنين عمر ابن الخطاب يعلمه إنه قد عزم على قيسارية أو إلى بيت المقدس وانه منتظر ما يأمره به والسلام وأرسل الكتاب مع عرفجة بن ناصح النخعي وأمره بالمسير فسار حتى وصل المدينة فأرسل الكتاب لعمر رضي الله عنه فقرأه على المسلمين واستشارهم في الأمر,"Abu ‘Ubaydah: O Mu‘ath, your view is sound.So he wrote to him to inform him that he had resolved upon going either to Caesarea or Baytul Muqaddas and asked which of the two he should invade. ‘Umar read the letter out to the Muslims and asked for their views."
7,فقال علي رضي الله عنه يا أمير المؤمنين مر صاحبك أن يصير إلى بيت المقدس فيحدقوا بها ويقاتلوا أهلها فهو خير الرأي وأكبره وإذا فتحت بيت المقدس فاصرف جيشه إلى قيسارية فإنها تفتح بعد أن شاء الله تعالى كذا أخبرني رسول الله صلى الله عليه وسلم,"‘Ali: O Commander of the Believers, order your man to go to Baytul Muqaddas to besiege her and fight her people. This is the best option. Thereafter, if Allah Most High wills, He will conquer Caesarea. This is what Rasulullah told me."
8,قال صدقت يا أبا الحسن,"‘Umar: You have spoken the truth, Abu al-Hasan."
9,فكتب إليه بسم الله الرحمن الرحيم من عبد الله عمر بن الخطاب إلى عامله بالشام ابي عبيدة أما بعد فاني أحمد الله الذي لا إله إلا هو وأصلي على نبيه,He then wrote the following letter:
10,وقد ورد علي كتابك وفيه تستشيرني في أي ناحية تتوجه إليها وقد اشار ابن عم رسول الله صلى الله عليه وسلم بالسير إلى بيت المقدس فإن الله سبحانه وتعالى يفتحها على يديك والسلام عليك,"I have received your letter which asks as to which direction you should advance in. The cousin of Rasulullah recommends that you march on Baytul Muqaddas for Allah, Most Pure and High will conquer her through you."
11,ثم طوى الكتاب ودفعه إلى عرفجة وأمره أن يعجل بالمسير فسار حتى قدم على على أبي عبيدة فوجده على الجابية فدفع الكتاب إليه فقرأ على المسلمين ففرحوا بمسيرهم إلى بيت المقدس فعندها دعا أبو عبيدة بخالد بن الوليد وعقد له راية وضم إليه خمسة آلاف فارس من خيل الزحف وسرحه إلى بيت المقدس ثم دعا بيزيد بن أبي سفيان وعقد له راية على خمسة آلاف وأمره أن يلحق بخالد إلى بيت المقدس,"He folded the letter and handed it for delivery to ‘Arfajah.The messenger met Abu ‘Ubaydah at al-Jabiyah where he gave him the letter. Abu ‘Ubaydahread it out to the Muslims who rejoiced at going to Baytul Muqaddas. He called Khalid gave him a flag and sent him with 5,000 elite cavalry to Baytul Muqaddas. He then ordered Yazid bin Abi Sufyanto meet Khalid at Baytul Muqaddas with another 5,000."
12,وقال له: يا ابن أبي سفيان ما علمتك إلا ناصحا فإذا أشرفت على بلد ايلياء فارفعوا أصواتكم بالتهليل والتكبير واسألوا الله بجاه نبيه ومن سكنها من الأنبياء والصالحين أن يسهل فتحها على أيدي المسلمين,"He said, “O Ibn Abi Sufyan, I only know you to be a well-wisher. When you reach Ayla {Roman name for Baytul Muqaddas – translator s note) raise your voices with, “La ilaha illallah,” and “Allahu Akbar”. Ask Allah, through the intercession of His Prophet S as well as the other prophets and pious people who dwelt in Baytul Muqaddas, to make her conquest easy for the Muslims.”"
13,فأخذ يزيد الراية وسار يريد بيت المقدس فسار ثم دعا شرحبيل بن حسنة كاتب وحي النبي صلى الله عليه وسلم وعقد له راية وضم إليه خمسة آلاف فارس من أهل اليمن وقال له: سر بمن معك حتى تقدم بيت المقدس وانزل بعسكرك عليها ولا تختلط بعسكر من تقدم قبلك,"Yazid took the flag and went.Abu ‘Ubaydah then summoned Shurahbil bin Hasanah and gave him 5,000 Yamani horsemen, saying, “Take these men to Baytul Muqaddas but when you reach there do not mix your troops with the other armies who arrived there before you.”"
14,ثم دعا بالمرقال بن هاشم بن عتبة بن أبي وقاص وضم إليه خمسة آلاف فارس مع جمع من المسلمين وسرحه على أثر شرحبيل ابن حسنة وقال له: انزل على حصنها وانت منعزل عن أصحابك,"Then he called al-Mirqal bin Hashim bin ‘Utbah bin Abi Waqqas. He sent him behind Shurahbilwith 5,000 horsemen of mixed tribes and said, “Camp at the fort of Baytul Muqaddas and remain separated from the other Muslim armies.”"
15,ثم عقد راية خامسة فسلمها للمسيب ابن نجية الفزاري وأمره أن يلحق بأصحابه وضم إليه خمسة آلاف فارس من النخع وغيرهم من القبائل وعقد راية سادسة وسلمها إلى قيس بن هبيرة المرادي وضم إليه خمسة آلاف فارس وسيره وراءه ثم عقد راية سابعة وسلمها إلى عروة بن مهلهل بن يزيد الخيل وضم إليه خمسة آلاف فارس وسيره وراءهم,"The fifth flag was for al-Musayyib bin Najiyah with 5,000 cavalry from Nakha and other tribes. The sixth flag was for Qays bin Hubayrah with 5,000 cavalry and the seventh for ‘Urwah bin Muhalhil bin Zayd al-Khayl with 5,000 cavalry."
16,فكان جملة من سرحه أبو عبيدة إلى بيت المقدس خمسة وثلاثين الفا وسارت السبعة أمراء في سبعة أيام في كل يوم أمير وذلك كله يرهب به اعداء الله فبقي كل يوم ينزل عليهم أمير بجيشه.,"Abu ‘Ubaydah thus sent a total of 35,000 men to Baytul Muqaddas. Each day a different one of the seven generals departed for the city. This was to terrify Allah’s enemies."
17,فكان أول من طلع عليهم بالراية خالد بن الوليد فلما أشرف عليهم كبر وكبر أصحابه فلما سمع أهل بيت المقدس ضجيج اصواتهم انزعجوا وتزعزعت قلوبهم وصعدوا على أسوار بلدهم فلما نظروا إلى قلة المسلمين استحقروهم وظنوا أن ذلك جميع المسلمين فنزل خالد ومن معه مما يلي باب أريحاء,"The first to arrive was Khalid. He and his men raised cries of “Allahu Akbar! Allahu Akbar!” to such an extent that the people became alarmed and their hearts shook. They climbed up the city walls and upon seeing his small force, thought that it was the entire army and considered it quite petty. Khalidcamped at the Jericho Gate."
18,واقبل في اليوم الثاني يزيد بن أبي سفيان وفي اليوم الثالث شرحبيل بن حسنة وأقبل في اليوم الرابع المرقال وأقبل في اليوم الخامس المسيب بن نجيبة وأقبل في اليوم السادس قيس بن هبيرة فنزل وأقبل في اليوم السابع عروة بن مهلهل بن زيد الخيل فنزل مما يلي طريق الرملة,"On the second day, Yazid bin Abi Sufyanarrived; Shurahbil bin Hasanahon the third; al-Mirqal on the fourth; al-Musayyib bin Najiyah on the fifth; Qays bin Hubayrah on the sixth and ‘Urwah bin Muhalhil, who camped near the ar-Ramlah roads, arrived on the seventh day."
19,قال عبد الله بن عامر بن ربيعة الغطفاني ما نزل أحد من المسلمين على بيت المقدس إلا وكبر وصلى ما قدره الله عليه ودعا بالنصر والظفر على الأعداء,"‘Abdullah bin ‘Amir bin Rabi‘ah al-Ghatfani narrates:Every Muslim who arrived at Baytul Muqaddas proclaimed, “Allahu Akbar!” and performed Salah for as long as Allah desired him to. He would then beseech Allah for victory against the enemies."
20,ويقال أن خالدا كان هو وأبو عبيدة قال فلما مضى العسكر قام أبو عبيدة وخالد وبقية المسلمين والذراري والسواد والغنم وما أفاء الله على المسلمين من المواشي والأموال فلم يبرحوا من مكانهم,"In other reports Yazidwas sent first while Abu ‘Ubaydah, Khalid, the remainder of the army, the women, the children, the animals and all the booty Allah had granted to the Muslims remained at their place."
21,سقطمن النسخة,The siege of Baytul Muqaddas
22,قال واقام العسكر على بيت المقدس ثلاثة أيام لا يبارزهم حرب ولا ينظرون رسولا يأتي إليهم ولا يكلمهم أحد من أهلها إلا إنهم قد حصنوا أسوارهم بالمجانيق والطوارق والسيوف والدرق والجواشن والزرد الفاخرة,"For three days not so much as a duel took place. The enemy neither sent an envoy nor spoke to the Muslims in any way. Instead, they heavily fortified their walls with catapults, swords, shields and assorted weaponry."
23,قال المسيب بن نجية الفزاري ما نزلنا ببلد من بلاد الشام فرأينا أكثر زينة ولا أحسن عدة من بيت المقدس وما نزلنا بقوم إلا وتضعضعوا لنا وداخلهم الهلع وأخذتهم الهيبة إلا أهل بيت المقدس نزلنا بازائهم ثلاثة أيام فلم يكلمنا منهم أحد ولا ينطقون غير أن حارسهم شديد وعدتهم كاملة,"Al-Musayyib bin Najiyah al-Fazari narrates:We had not come to any city in all of Syria which was more highly decorated and equipped than Baytul Muqaddas. The people of every place we came to became feeble, and despair and fear entered their hearts – not so Baytul Muqaddas. We besieged them for three days but not a single one of them came to speak to us. All they did was show off their tight security and defences."
24,فلما كان في اليوم الرابع قال رجل من البادية لشرحبيل بن حسنة أيها الأمير كأن هؤلاء القوم صم فلا يسمعون أو بكم فلا ينطقون أو عمي فلا يبصرون ازحفوا بنا إليهم,"On the fourth day a bedouin said to Shurahbil, “O commander, it is as if these people are deaf and cannot hear us or dumb and cannot speak to us or blind and cannot see us. Lead us in an attack against them.”"
25,فلما كان في اليوم الخامس وقد صلى المسلمون صلاة الفجر كان أول من ركب من المسلمين من الأمراء لسؤال أهل بيت المقدس يزيد بن أبي سفيان فشهر سلاحه وجعل يدنو من سورهم وقد أخذ معه ترجمانا يبلغه عنهم ما يقولون فوقف بازاء سورهم بحيث يسمعون خطابه وهم صامتون.,"After Salatul Fajr on the fifth day, Yazid bin Abi Sufyan went to speak to them. He unsheathed his sword and took a translator with him. He reached close enough to the city wall for them to hear him, but they maintained their silence."
26,فقال لترجمانه قل: لهم أمير العرب يقول لكم: ماذا تقولون في إجابة الدعوة إلى الإسلام والحق وكلمة الإخلاص وهي كلمة لا إله إلا الله محمد رسول الله حتى يغفر لكم ربنا ما سلف من ذنوبكم وتحقنون بها دماءكم وأن أبيتم ولم تجيبونا فصالحوا عن بلدكم كما صالح غيركم ممن هو أعظم منكم عدة واشد منكم وأن أبيتم هاتين الحالتين حل بكم البوار وكان مصيركم إلى النار,"Yazid: Say to them that the commander of the ‘Arabs says – Will you not accept an invitation to Islam, to the Truth, to the declaration of sincerity i.e. “There is no deity but Allah and Muhammad is the Messenger of Allah.” Our Rabb will then forgive all your past sins and your blood will be safe. If you refuse then surrender as those before you surrendered. Bear in mind that they were stronger and greater in number than you. If you refuse both these options then min will befall you and you can reserve your place in Hell."
27,قال فتقدم الترجمان إليهم وقال لهم: من المخاطب عنكم,"Translator: O people, who is your spokesman?"
28,فكلمه قس من القساوسة عليه مدارع الشعر وقال أنا المخاطب عنهم ماذا تريد,Priest (wearing clothing of hair): I am. What do you want?
29,فقال الترجمان أن هذا الأمير يقول: كذا وكذا ويدعوكم إلى أحدى هذه الخصال الثلاث أما الدخول في الإسلام او اداء الجزية واما السيف,Translator: The general calls you to this… so you now have three options; either Islam or Jizyah or the sword.
30,قال فبلغ القس من وراءه ما قال الترجمان قال فضجوا بكلمة كفرهم وقالوا: لا نرجع عن دين العز والقبول وأن قتلنا اهون علينا من ذلك فبلغ الترجمان ذلك ليزيد قال فمشى إلى الأمراء وأخبرهم بجواب القوم قال لهم: ما انتظاركم بهم,"The priest conveyed the message to those behind him. They made declarations of their disbelief and said, “We will never leave the religion of honour. To be killed is a lighter matter for us.” The translator translated for Yazid who went to tell the othergenerals and said, “Why are you still waiting to attack them?”"
31,فقالوا: إن الأمير أبا عبيدة ما أمرنا بالقتال ولا بحرب القوم بل بالنزول عليهم ولكن نكتب إلى أمين الأمة فإن امرنا بالزحف زحفنا,"Generals: Abu ‘Ubaydah has not ordered us to attack them, only to besiege them. We should write to him and if he permits, we will attack."
32,فكتب يزيد بن ابي سفيان إلى ابي عبيدة يعلمه بما كان من جواب القوم فما الذي تأمر فكتب إليهم أبو عبيدة يأمر بالزحف وانه وأصل في أثر الكتاب فلما وقف المسلمون على كتاب ابي عبيدة فرحوا واستبشروا وباتوا ينتظرون الصباح.,"Yazid therefore wrote to him, informing him of their reply and requesting further instructions. Abu ‘Ubaydah replied that they should attack and that he would personally arrive soon. Upon receiving the letter, the Muslims spent the night rejoicing and awaiting the arrival of morning."
33,قال الواقدي: ولقد بلغني أن المسلمين باتوا تلك الليلة كأنهم ينتظرون قادما يقدم عليهم من شدة فرحهم بقتال أهل بيت المقدس وكل أمير يريد أن يفتح على يديه فيتمتع بالصلاة فيه والنظر إلى آثار الأنبياء,They all anticipated fighting the enemy and every general hoped that the city’s conquest would be at his hands so that he could be the first to perform salah therein and observe all the sacred relics of the ancient prophets.
34,قال فلما أضاء الفجر أذن وصلت الناس صلاة الفجر قال فقرأ يزيد لأصحابه: {يَا قَوْمِ ادْخُلُوا الْأَرْضَ الْمُقَدَّسَةَ الَّتِي كَتَبَ اللَّهُ لَكُمْ وَلا تَرْتَدُّوا} [المائدة: 21] الآية,"At dawn, Yazid led his men in Salatul Fajr and recited:O my people enter the sacred land (Baytul Muqadda andsurrounds) which Allah has decreed for you and do not turnback. [5:23]"
35,فيقال أن الأمراء أجرى الله على ألسنتهم في تلك الصلاة أن قرأوا هذه الآية كأنهم على ميعاد واحد فلما فرغوا من الصلاة نادوا النفير النفير يا خيل الله اركبي,"It is said that Allah inspired each general to recite that verse as if they had all agreed to it. After Salah it was called out, “To arms! To arms! O cavalry of Allah, mount your horses.”"
36,قال فأول من برز للقتال حمير ورجال اليمن وبرز المسلمون للحرب كأنهم أسود ضارية,The first to advance was the Himyar and the other Yamanis. The Muslims advanced like a striking black snake.
37,ونظر إليهم أهل بيت المقدس وقد انشرحوا لقتالهم فنشطهم ورشقوا المسلمين بالنشاب فكانت كالجراد فجعل المسلمون يتلقونها بدرقهم فلم تزل الحرب بينهم من الغد إلى الغروب يقاتلون قتالا شديدا ولم يظهروا فزعا ولا رعبا ولم يطمعوهم في بلدهم,"The enemy watched, all spread out in battle-array. They began opening fire, showering the Muslims with arrows like a swarm of locusts. The Muslims protected themselves with their shields. The battle was fierce and lasted from morning until sunset. The enemy showed no fear and gave the Muslims no hope of conquering their city."
38,فلما غربت الشمس رجع الناس وصلى المسلمون ما فرض الله عليهم وأخذوا في اصلاح شأنهم وعشائهم فلما فرغوا من ذلك أوقدوا النيران واستكثروا منها لأن الحطب عندهم كثير فبقي قوم يصلون وقوم يقرأون وقوم يتضرعون وقوم نائمون مما لحقهم من التعب والقتل,"At sunset the Muslims returned to their camp and performed the salah which Allah had decreed upon them. They saw to themselves and ate supper. Thereafter they lit numerous fires because they had plenty of firewood with them. Some engaged in Salah, others recited the Quran, others wept before Allah while the fatigued ones slept."
39,فلما كان الغد بادر المسلمون إليهم وذكروا الله كثيرا وأثنو عليه وصلوا على رسول الله صلى الله عليه وسلم وتقدمت رماة النبل وأقبلوا يرمون ويذكرون الله وهم يضجون إلى الله بالدعاء.,"The next morning the Muslims again advanced, taking the name of Allah profusely, praising Him and sending salutations upon Rasulullah. The archers went ahead and began firing, taking the name of Allah with each arrow shot and loudly making du‘a."
40,قال الواقدي: ولم يزل المسلمون على القتال عدة أيام وأهل بيت المقدس يظهرون الفرح وانه ليس على قلوبهم من هم ولا جزع فلما كان اليوم الحادي عشر أشرفت عليهم راية أبي عبيدة يحملها غلامه سالم ومن ورائها فرسان المسلمين وابطال الموحدينوقد أحدقوا بأبي عبيدة وخالد عن يمينه وعبد الرحمن بن أبي بكر عن يساره وجاءت النسوان والأموال وضج الناس ضجة واحدة بالتهليل والتكبير فاجابتهم القبائل,"The Muslims fought the people of Baytul Muqaddas for ten days, but the enemy only displayed happiness and showed not the least trace of fear. On the eleventh day, Abu ‘Ubaydah’s slave, Salim, was seen coming, carrying his master’s flag. Abu ‘Ubaydah then arrived, surrounded by horsemen. On his right was Khalid and, on his left, ‘Abdurahman bin Abi Bakr. The Muslims gave a huge shout of “La ilaha illallah wallahu AkbarF’which spread amongst the tribes."
41,سقطمن النسخة,The Patriarch of Baytul Muqaddas
42,ووقع الرعب في قلوب أهل بيت المقدس فانقلب كبارهم وعظماؤهم وبطارقتهم إلى البيعة العظمى عندهم وهي الغمامة فلما وقفوا بين يدي جئليقهم وكانوا يعظمونه ويبجلونه فلما سمعوا تلك الضجة دخلوا عليه ووقفوا بين يديه وخضعوا له وقالوا: يا ابانا قد قدم أمير القوم إلينا ومعه بقية المسلمين وهذه الضجة بسببه فلما سمع بتركهم وجائليقهم تغير لونه وتغير وجهه وقال هي هي,"The Christians finally felt fear. Their leaders, elders and patricians went to the greatCathedral of al-Qumamah or al-Tmamah. They humbly submitted themselves beforethe patriarch whom they greatly revered and said, “O father, their chief commanderhas brought the rest of the Muslims and is causing this great noise.” When the bishop heard this his face and colour changed and he said, “This is it. This is it.”"
43,قالوا: ما ذلك أيها البترك والاب الكبير قال وحق الإنجيل أن كان قدم اميرهم فقد دنا هلاككم والسلام قالوا: وكيف ذلك,"Christians: What is it, O our patriarch and great father?"
44,قال: لانا نجد في العلم الذي ورثناه عن المتقدمين أن الذي يفتح الأرض في الطول والعرض هو الرجل الاسمر الأحور المسمى بعمر صاحب نبيهم محمد فإن كان قد قدم فلا سبيل لقتاله ولا طاقة لكم بنزاله ولا بد لي أن اشرف عليه وانظر إليه والى صورته فإن كان إياه عمدت إلى مصالحته واجبته إلى ما يريد,Patriarch: We have learnt from knowledge inherited from the ancients that a reddish-brown man named ‘Umar who is a companion of their prophet called Muhammad will conquer the length and breadth of the land. If he has come then there is no way of fighting him and you will have no power against him. I must examine his appearance. If it is indeed him then I will surrender and accept whatever he demands.
45,وأن كان غيره فلا نسلم إليه قط لأن مدينتنا لا تفتح إلا على يد من ذكرته لكم والسلام,If it someone else then we shall never surrender for none but ‘Umar can conquer our city.
46,ثم إنه وثب قائما والقسوس والرهبان والشمامسة من حوله وقد رفعوا الصلبان على رأسه وفتحوا الإنجيل بين يديه ودارت البطارقة من حوله وصعد على الصور من الجهة التي فيها أبو عبيدة فنظر إلى المسلمين وهم يسلمون عليه ويعظمونه ثم يرجعون إلى القتال كأنهم الاسد الضارية,"The patriarch got up surrounded by priests, monks and acolytes who raised the cross above his head and opened the Bible before him. The patricians then also gathered around him. He climbed the city wall at the side where Abu ‘Ubaydahhad arrived. He saw the Muslims making salam and honouring their commander. They immediately returned to fighting like hunting lions."
